,company_name,num_employees,past_companies,past_schools,category_groups,headquarters_location,crunchbase_rank,last_funding_type,last_funding_amount,total_funding_amount,trend_score,categories,founded_date,status,last_funding_date,total_equity_funding_amount,time_since_last_funding,funding_ratio,score
1359,Koru,45,"Koru, Occidental College, SapientRazorfish, Bill & Melinda Gates Foundation, Starwood Hotels","Bates College, Occidental College, Washington State University, Harvard Business School, Santa Clara University","Information Technology, Education","Seattle, Washington, United States",7399,Series A,"$8,000,000",12570000,-0.7,"Information Technology, Training, Education",09/01/2013,Operating,01/29/2015,12570000,2.8,12.57,0.828
1360,FreshGrade,42,"Disney Consumer Products and Interactive, D2L, Gaggle, Electronic Arts (EA), Centre for Arts and Technology","The University of British Columbia, University of Victoria, Simon Fraser University, University of Calgary, Okanagan College","Information Technology, Software, Education","Kelowna, British Columbia, Canada",7418,Series A,"$11,600,000",15900000,-0.6,"Education, EdTech, Management Information Systems",01/01/2011,Operating,05/10/2016,15900000,1.52,15.9,0.878
1361,Sherpaa,15,"GE Healthcare, Personal, Hello Health Inc., Lot18, FirstMark Capital","Stanford University, The Johns Hopkins University School of Medicine, University of Rochester School of Medicine and Dentistry, The Wright Institute, Wesleyan University","Administrative Services, Health Care, Financial Services","New York, New York, United States",7419,Series Unknown,"$6,175,213",7975213,-0.6,"Delivery, Insurance, Health Care",02/01/2012,Operating,04/28/2015,7975213,2.56,7.975,1.287
1364,Privacy Labs,7,"T-Mobile, Wave Systems Corp., Microsoft, Mobilisafe, Rapid7","Peking University, Stanford University, UC Irvine, University of California Los Angeles, Harvard University","Hardware, Software, Internet Services, Mobile","Los Altos, California, United States",24834,Series A,"$8,000,000",8000000,0.4,"Cloud Infrastructure, Mobile, Enterprise Software",01/01/2011,Operating,07/11/2013,8000000,4.36,8,0.796
1365,Despegar.com,2081,"Despegar.com, Globant, LIFIA, LAN Airlines, TelefÌ_nica Argentina","University of Buenos Aires, Universidad TecnolÌ_gica Nacional, Universidad Nacional de La Plata, Universidad de la RepÌ¼blica, UADE","Travel and Tourism, Community and Lifestyle","Miami, Florida, United States",7452,Series Unknown,"$21,000,000",31500000,-0.5,"Leisure, Travel, Hospitality",01/01/1999,Operating,03/21/2012,31500000,5.66,31.5,0.786
1366,PPDai,255,"OperaSolutions, PPDai, Žª ŽàÔ¾äÛ, Microsoft, Wipro Limited","Shanghai Jiao Tong University, Fudan University, Sichuan University, Shanghai University of Finance and Economics, Shanghai University",Financial Services,"Shanghai, Shanghai, China",7471,Series C,,70200000,-0.1,"Peer to Peer, FinTech, Finance",08/01/2007,Operating,04/03/2015,70200000,2.63,70.2,0.836
1367,Cell Design Labs,44,"Amgen, Genentech, Exelixis, Cell Design Labs, Amyris","University of California Davis, University of California Berkeley, University of California Los Angeles, University of California Santa Cruz, Heidelberg University","Biotechnology, Science and Engineering, Health Care","San Francisco, California, United States",7490,Series Unknown,"$34,400,000",34400000,1.4,"Health Care, Therapeutics, Biotechnology",01/01/2015,Operating,06/02/2016,34400000,1.46,34.4,0.881
1368,CrowdMed,16,"Tamil Nadu Veterinary and Animal Sciences University, Everyday Health Inc., Mustang Daily, WebMD, Monash University Malaysia","University of Illinois at Urbana-Champaign, University of Maryland College Park, Stanford University, Massachusetts Institute of Technology, Vellore Institute of Technology","Software, Health Care","San Francisco, California, United States",7499,Seed,,3145000,0.6,"Crowdsourcing, Health Care, Software",01/01/2012,Operating,02/22/2017,3145000,0.73,3.145,1.083
1369,Ogin,107,"Ogin Inc., GE, Siemens, Tetra Tech EC Inc., GE Power","Aalborg Universitet, University of MÌ_nster, Western New England University, Washington University in St. Louis, Cornell University","Manufacturing, Energy, Information Technology, Sustainability","Waltham, Massachusetts, United States",7514,Series Unknown,"$55,000,000",104325400,1.4,"Clean Energy, Information Technology, Manufacturing",01/01/2007,Operating,12/19/2013,95500000,3.92,95.5,0.804
1370,Fenda,113,"Intex Technologies (India) Ltd., Fenda Audio India Private Ltd., Philips, Moser Baer India Ltd, 5 Core Electronics Ltd","Delhi University, Indira Gandhi National Open University, Jiwaji University, Pandit Ravishankar Shukla University, University of Mumbai","Apps, Community and Lifestyle, Software, Internet Services, Mobile","Beijing, Beijing, China",7516,Series A,,25000000,-0.3,"Mobile Apps, Online Forums, Q&A",05/01/2016,Operating,11/25/2016,25000000,0.98,25,0.893
1371,Clark,24431,"Kimberly-Clark, Unilever, Procter & Gamble, NestlÌ©, Colgate-Palmolive","University of Wisconsin Oshkosh, University of Wisconsin-Madison, Universidade de Mogi das Cruzes, Fox Valley Technical College, FGV - FundaÌ¤Ì£o Getulio Vargas","Apps, Software, Professional Services, Education, Mobile","New York, New York, United States",7518,Seed,"$2,500,000",3500000,-1.4,"Freelance, Mobile Apps, Tutoring, Education",05/01/2016,Operating,06/27/2017,3500000,0.39,3.5,0.898
1372,Health IQ,118,"SelectQuote Insurance Services, AIG Direct, Health IQ, US Navy, San Diego Padres","San Diego State University, University of California San Diego, Chapman University, Stanford University, University of Wisconsin-Madison","Biotechnology, Science and Engineering, Health Care","Mountain View, California, United States",7536,Seed,"$5,500,000",5500000,-1.4,"Pharmaceutical, Biotechnology, Health Care",01/01/2014,Operating,12/17/2014,5500000,2.92,5.5,0.824
1373,BloomNation,37,"BloomNation, XO Group Inc., Dealertrack, Nordstrom, Los Alamos National Laboratory","University of California Santa Barbara, General Assembly, University of California Berkeley, University of Phoenix, California State University Northridge","Commerce and Shopping, Consumer Goods","Los Angeles, California, United States",7542,Series A,"$5,550,000",7200000,-0.6,"Flowers, Retail, E-Commerce",03/22/2010,Operating,10/07/2014,7200000,3.12,7.2,0.819
1374,Zaarly,14,"Cerner Corporation, University of Missouri-Columbia, McKinsey & Company, Iowa Democratic Party, Kauffman Foundation","Southern Methodist University, University of California Berkeley, Harvard Business School, Truman State University, University of Missouri-Columbia","Platforms, Commerce and Shopping, Software, Internet Services, Mobile","San Francisco, California, United States",7587,Series Unknown,,15150000,-0.6,"iOS, Internet, Mobile, E-Commerce, Android",02/20/2011,Operating,09/01/2016,15150000,1.21,15.15,0.888
1375,MikMak,6,"Student Abroad Travel, Crowne Plazaå¨ Hotels & Resorts, ELDAR GROUP, Taktitech","University of Westminster, University of Gothenburg, Fordham University","Apps, Commerce and Shopping, Media and Entertainment, Software, Video","Brooklyn, New York, United States",7627,Seed,"$3,200,000",3200000,-1.1,"Shopping, Apps, Video, Retail",01/01/2014,Operating,08/02/2016,3200000,1.29,3.2,1.073
1376,MATRIXX Software,124,"Oracle, Portal Software, Ericsson, IBM, eServGlobal","San Jose State University, University of California San Diego, Monash University, Western Sydney University, Victoria University","Hardware, Data and Analytics, Software","Mountain View, California, United States",7667,Series Unknown,"$5,000,000",38600000,-0.4,"Real Time, Telecommunications, Big Data, Software",01/01/2008,Operating,03/30/2016,38600000,1.64,38.6,0.874
1377,Thync,12,"Symyx Technologies, Massachusetts Institute of Technology, Princeton University, Thync Global Inc., StudioPMG","Princeton University, Stanford University, California State University-Sacramento, Pacific Union College, University of California Berkeley","Biotechnology, Science and Engineering, Hardware, Information Technology, Consumer Electronics","Los Gatos, California, United States",7669,Series A,"$13,000,000",13000000,-0.3,"Neuroscience, Information Technology, Consumer Electronics",01/01/2011,Operating,10/08/2014,13000000,3.11,13,0.819
1378,PPzuche.com,98,"MOZAT PTE LTD, Baidu Inc., Microsoft, JD.COM, Meituan-Dianping","Tsinghua University, Beijing Technology and Business University, Fujian Agriculture and Forestry University, Shanxi Agricultural University, University of Florida",Transportation,"Beijing, Beijing, China",7671,Series C,"¥500,000,000",148513848,3.1,"Car Sharing, Transportation, Peer to Peer",01/01/2012,Operating,09/02/2015,148513848,2.21,148.514,0.855
1379,Drobo,69,"OCZ Storage Solutions - A Toshiba Group Company, Drobo Inc., Oracle, Overland-Tandberg (a subsidiary of Sphere 3D), Sun Microsystems","San Diego State University, Mission College, Universidade Federal de Santa Catarina, University of Reading, The University of Auckland","Hardware, Information Technology, Software","San Jose, California, United States",7678,Debt Financing,"$4,000,000",57000000,-0.4,"Data Storage, Virtualization, Hardware",01/01/2004,Operating,09/29/2015,53000000,2.14,53,0.855
1381,vip.com,2622,"VIP.com ŒÓøŒÒŠ__, eBay, Ericsson, Œ_»Œ__¾«Ü_ÔÈÏ, IBM","Sun Yat-Sen University, South China University of Technology, South China Normal University, Guangdong University of Foreign Studies, Guangdong University of Technology","Science and Engineering, Data and Analytics, Software, Internet Services, Financial Services, Artificial Intelligence","Los Angeles, California, United States",45245,Series Unknown,,3000000,-3,"Artificial Intelligence, Internet, FinTech",09/16/2016,Operating,06/01/2017,3000000,0.46,3,0.898
1383,Renmatix,51,"The Dow Chemical Company, Rohm and Haas, Renmatix, Air Products, NatureWorks","Georgia Institute of Technology, Universidade Federal de Minas Gerais, Western University, Queen's University, Universidad de Valladolid","Biotechnology, Science and Engineering","San Carlos, California, United States",41203,Series Unknown,"$2,100,000",5650000,0,Biotechnology,01/01/2003,Operating,11/24/2009,5650000,7.99,5.65,0.93
1384,3VR,55,"Oracle, 3VR, Logitech, Communications Supply Corporation (WESCO), Siebel Systems UK Limited","San Jose State University, University of California Berkeley, Western Illinois University, University of Kentucky, Andhra University","Media and Entertainment, Information Technology, Data and Analytics, Software, Internet Services, Video, Privacy and Security","San Francisco, California, United States",7688,Series Unknown,"$8,000,000",64567194,-0.2,"Visual Search, Analytics, Enterprise Software, Data Integration, Security, Video, Big Data",01/01/2002,Operating,01/13/2015,61000000,2.85,61,0.828
1385,Rubica,3600,"Young & Rubicam, Ogilvy & Mather, Leo Burnett, J. Walter Thompson Worldwide, Wunderman","University of Buenos Aires, Miami Ad School, ESPM Escola Superior de Propaganda e Marketing, Florida International University, Faculdade CÌÁsper LÌ_bero",,"San Francisco, California, United States",7691,Seed,"$5,600,000",5600000,-1.8,Consumer,12/23/2016,Operating,05/16/2017,5600000,0.51,5.6,0.897
1386,mySupermarket,64,"mySupermarket, dunnhumby, Israel Defense Forces, Barbican Centre, Infopulse","University of Leeds, Tel Aviv University, The Open University of Israel, Bar-Ilan University, Bezalel Academy of Art and Design","Commerce and Shopping, Food and Beverage","London, England, United Kingdom",7724,Series D,"$10,000,000",32800000,-0.8,"Food and Beverage, Grocery, Shopping",01/01/2005,Operating,04/19/2012,32800000,5.58,32.8,0.787
1387,BountyJobs,56,"BountyJobs, Noesis Finance, RenewData, an LDiscovery Company, Digital Motorworks, Samson Resources","The University of Texas at Austin, Novosibirsk State University (NSU), University of Connecticut, University of Idaho, Binghamton University","Software, Professional Services","Austin, Texas, United States",7730,Series D,"$4,505,237",29805235,0.1,"Software, Recruiting, Human Resources",11/14/2006,Operating,10/21/2013,29805235,4.08,29.805,0.95
1388,CapLinked,18,"PayPal, Kauffman Foundation, Maker Studios Inc, CapLinked, Midwestern Baptist Theological Seminary","California Polytechnic State University-San Luis Obispo, Stanford University, Shanghai University of Finance and Economics, University of Cambridge, Universidad AutÌ_noma de Guadalajara","Software, Financial Services","Redondo Beach, California, United States",7737,Series Unknown,"$1,000,000",10400000,-0.1,"Enterprise Software, Finance, Software, Collaboration",08/02/2010,Operating,12/01/2015,10400000,1.96,10.4,0.861
1389,Medal,31,"Novartis, The University of Texas at Austin, AT&T, Brown University, Emoki","University of California Los Angeles, Boston University, Brown University, Technische UniversitÌ_t Wien, Beijing Language and Culture University","Information Technology, Health Care","San Francisco, California, United States",7742,Seed,"$3,775,990",3775990,-0.8,"Information Technology, Medical, Health Care",01/01/2015,Operating,05/13/2016,3775990,1.52,3.776,0.878
1391,Wrap Media,13,"Digital Garage, EY, Google, MediaCT, Neo Innovation Inc.","Tokyo Institute of Technology, Harvard University, Johannes Gutenberg University Mainz, The Philipp University of Marburg, University of Leeds","Media and Entertainment, Content and Publishing","Bangalore, Karnataka, India",41129,Series Unknown,"$5,000,000",5000000,0,News,01/01/2007,Operating,12/22/2008,5000000,8.91,5,0.779
1392,GreenDust,54,"Machwan Communication & Research, Interactive Business Solutions Pvt. Ltd, Shergroup, Hewlett Packard Enterprise, Rent-A-Center","Universidad Externado de Colombia, Barkatullah Vishwavidyalaya, Karnataka State Open University, Madurai Kamaraj University, Maharshi Dayanand University","Commerce and Shopping, Transportation, Internet Services","Delhi, Delhi, India",7765,Series C,"$10,000,000",50000000,1.1,"Internet, Logistics, E-Commerce",10/01/2008,Operating,09/20/2013,50000000,4.16,50,0.799
1393,Lenda,29,"Wells Fargo, Fidelity Investments, LendingClub, Sungevity, Lenda","University of San Francisco, NYU Stern School of Business, City College of San Francisco, University of Vienna, University of Sydney","Real Estate, Financial Services","San Francisco, California, United States",7791,Series Unknown,"$2,000,000",3996000,-0.4,"Real Estate, Finance",08/18/2012,Operating,11/24/2015,3996000,1.98,3.996,0.86
1394,ALOHA,108,"The University of Georgia, ALOHA, Merrill Lynch, Ashok Leyland, Northside Hospital","The University of Georgia, Universitat AutÌ_noma de Barcelona, B H Gardi College of Engineering & Technology, University of Melbourne, State University of Bangladesh","Sports, Health Care","New York, New York, United States",7800,Series Unknown,,4500000,-0.2,"Wellness, Fitness, Health Care",01/01/2012,Operating,11/13/2014,4500000,3.01,4.5,0.822
1395,FLX Bio,60,"Flexus Biosciences, Genentech, Amgen, Bristol-Myers Squibb, Stanford University","University of California Berkeley, San Francisco State University, University of California Davis, University of Geneva, University of Oxford","Biotechnology, Science and Engineering, Health Care","South San Francisco, California, United States",7801,Series B,"$50,000,000",79000000,1.8,"Therapeutics, Medical, Biotechnology",04/01/2015,Operating,04/26/2016,79000000,1.56,79,1.216
1399,Service,12469,"IBM Global Business Services Talent & Engagement, IBM, Accenture, GENPACT, IBM Global Business Process Services","Delhi University, Bangalore University, University of the Philippines, Kendriya Vidyalaya, Polytechnic University of the Philippines","Information Technology, Real Estate, Internet Services","New York, New York, United States",29887,Series Unknown,"$54,000,000",54000000,-1.7,"Enterprise, Information Services, Facility Management, Internet, SaaS",01/01/1999,Operating,05/02/2017,54000000,0.55,54,0.899
1400,Abacus Labs,25,"Abacus Labs, Foursquare, Grovo, Amazon, Shake Inc.","Rensselaer Polytechnic Institute, Clemson University - College of Business, University of Colorado Boulder, University of Hartford, Wesleyan University","Travel and Tourism, Information Technology, Software, Professional Services, Financial Services","New York, New York, United States",7867,Seed,,3500000,-1.1,"Accounting, Information Technology, Travel, Software, SaaS",01/01/2013,Operating,07/18/2016,3500000,1.33,3.5,0.884
1401,Soraa,215,"Soraa, Intel Corporation, Lumileds, VIAVI Solutions, FormFactor Inc.","San Jose State University, University of California Santa Barbara, University of California Los Angeles, University of Illinois at Urbana-Champaign, University of California Berkeley","Manufacturing, Hardware, Consumer Electronics","Fremont, California, United States",7868,Debt Financing,"$8,000,000",101600000,-0.2,"Manufacturing, Lighting, Electronics",01/01/2008,Operating,01/31/2013,93600000,4.8,93.6,0.794
1402,Boom Fantasy,14,"IAF - Israeli Air Force, Carestream, High 5 Games, Saint Bonaventure University, Oracle","Stanford University Graduate School of Business, Illinois State University, Fairleigh Dickinson University, Columbia University in the City of New York, Indian Institute of Technology Delhi","Gaming, Sports, Mobile","New York, New York, United States",7876,Seed,"$2,000,000",3400000,-2.8,"Sports, Mobile, Fantasy Sports",12/01/2014,Operating,05/31/2017,3400000,0.47,3.4,1.348
1404,Returnly,23,"Optimizely, Centura Software, Glassdoor, Middlebury College, PowerReviews","Saint Michael's College, Bond University, UNSW, ESADE Business & Law School, Universidad AutÌ_noma de Madrid","Apps, Commerce and Shopping, Software, Mobile","Mountain View, California, United States",10792,Series Unknown,"$9,000,000",9000000,1.2,"Personalization, Mobile, E-Commerce, Apps",05/01/2013,Operating,07/17/2014,9000000,3.34,9,0.813
1405,Move Loot,7,"Stringcan, ClaimsComp Inc., Model N, Puregold Duty Free Inc., Actioncoach","Bataan Polytechnic State College, Tomas del Rosario College, University of California Santa Cruz, University of North Carolina at Chapel Hill, UNC Kenan-Flagler Business School","Commerce and Shopping, Consumer Goods","San Francisco, California, United States",7918,Series A,"$10,000,000",21800000,-0.5,"Retail, Furniture, E-Commerce, Marketplace",01/01/2013,Operating,08/01/2015,21800000,2.3,21.8,0.847
1406,DisplayLink,168,"DisplayLink, Nokia, Mentor Graphics, Motorola Mobility (a Lenovo Company), NXP Semiconductors","Politechnika _l€Éska w Gliwicach, University of Cambridge, University of York, AGH University of Science and Technology, Anglia Ruskin University","Science and Engineering, Hardware, Software","Palo Alto, California, United States",7921,Series Unknown,"$10,400,000",86650000,-0.6,"Software, Hardware, Semiconductor",01/01/2003,Operating,09/10/2012,78650000,5.19,78.65,0.79
1407,Shuttl,147,"Shuttl, Jabong, HealthKart, Tapzo, PayU","Delhi University, Indian Institute of Technology Delhi, Indian Institute of Technology Kanpur, Birla Institute of Technology and Science, Pilani, Indian School of Business","Apps, Software, Transportation, Mobile","Gurgaon, Haryana, India",7943,Series A,"$20,000,000",23150890,-0.5,"Mobile, Transportation, Apps",01/01/2015,Operating,12/22/2015,23150890,1.91,23.151,0.77
1408,Utilidata,44,"The Search Agency, Utilidata Inc., The Boston Consulting Group (BCG), APC by Schneider Electric, National Grid","University of Rhode Island, Worcester Polytechnic Institute, Northeastern University, University of Massachusetts Lowell, New England Institute of Technology","Energy, Information Technology, Sustainability, Software, Government and Military","Providence, Rhode Island, United States",7956,Series B,"$20,000,000",20000000,1.1,"Software, Energy, GovTech, Power Grid, Energy Efficiency",01/01/1983,Operating,12/09/2013,20000000,3.94,20,0.802
1410,Chukong Technologies,74,"Sohu.com, Beijing Kunlun Tech Co Ltd (SZ:300418), CSDN, Aubert Films, GE Capital","Beijing Normal University, Hubei University, Nankai University, Northeast Normal University, Anhui University","Gaming, Media and Entertainment, Software, Mobile","Beijing, Beijing, China",7967,Series D,"$50,000,000",83200000,3.3,"Mobile, Content Creators, Developer Tools, Digital Entertainment, Video Games",11/01/2010,Operating,10/18/2013,83200000,4.08,83.2,0.801
1412,Kite,58,"Z GROUP PLC, BrowserAngel, I-Link Solutions, Capgemini, M&C Saatchi London","Bath Spa University, King's College London, The Manchester Metropolitan University, University of Reading, National Institute of Technology Kurukshetra","Science and Engineering, Information Technology, Data and Analytics, Software, Artificial Intelligence","San Francisco, California, United States",7982,Seed,"$4,000,000",4000000,-1.1,"Developer Platform, Artificial Intelligence, Developer Tools, Information Services",02/01/2014,Operating,04/14/2016,4000000,1.59,4,0.875
1414,Arctic Wolf Networks,89,"BlackBerry, Code42, Blue Coat Systems acquired by Symantec, Dell Compellent, Dell","University of Waterloo, Conestoga College, University of Guelph, Saint John's University, University of Minnesota-Twin Cities","Hardware, Media and Entertainment, Information Technology, Internet Services, Video, Messaging and Telecommunications","London, England, United Kingdom",22064,Private Equity,"$10,000,000",32000000,0.4,"VoIP, Telecommunications, Video, Messaging",01/01/2005,Operating,06/26/2013,32000000,4.4,32,1.058
1415,textPlus,28,"textPlus, Electronic Arts (EA), EA Mobile, Cable&Wireless Worldwide, Meteor","The University of Auckland, University of California Los Angeles, University College Cork, Full Sail University, Gujarat University","Platforms, Information Technology, Community and Lifestyle, Software, Internet Services, Messaging and Telecommunications, Mobile","Marina Del Rey, California, United States",8015,Series Unknown,"$6,904,009",53229009,0.1,"iOS, Messaging, Android, Communities, Mobile",12/01/2007,Operating,03/25/2015,53229009,2.65,53.229,0.835
1416,Verne Global,37,"Verne Global, Nokia, Atos, Commvault, DFT (DuPont Fabros Technology)","Reykjavik University, Indian Institute of Technology Bombay, Stanford University, Harvard Business School, Massachusetts Institute of Technology","Hardware, Information Technology, Consumer Electronics","London, England, United Kingdom",8027,Series D,"$98,000,000",98000000,2,"Computer, Data Center, Information Technology",01/01/2007,Operating,01/12/2015,98000000,2.85,98,0.829
1418,Calient Technologies,83,"CALIENT Technologies Inc., Cisco, AT&T, 3Com, Nokia","University of California Santa Barbara, ITT Technical Institute-Oxnard, Indian Institute of Technology Kanpur, Osmania University, University of Madras","Manufacturing, Hardware, Information Technology, Consumer Electronics, Software, Internet Services","Goleta, California, United States",8042,Series Unknown,"$6,000,000",405118814,0.1,"Data Center, Electronics, Telecommunications, Consumer Electronics, Manufacturing, Cloud Computing",01/01/1999,Operating,08/16/2016,405118814,1.25,405.119,0.898
1419,OneID,6,"RatePoint, Inc, TC TrustCenter, Rocket Ninja, Employease, Webmaster Freelance","UniversitÌ© d'Angers, Columbia University in the City of New York, Algonquin College of Applied Arts and Technology, California State University-San Bernardino, Northwestern University - Kellogg School of Management","Information Technology, Software, Internet Services, Privacy and Security","San Francisco, California, United States",8046,Series A,"$7,000,000",7000000,2.8,"Developer APIs, Software, Identity Management, Internet of Things",01/01/2011,Operating,04/11/2012,7000000,5.61,7,0.786
1420,Runscope,6,"Keen IO, Twilio Inc., SC Fundamental LLC, Treefort | Screenfeed, Thomson Reuters","University of Florida - Warrington College of Business, Senac SÌ£o Paulo, University of California Berkeley, Harvard University, Pace University","Hardware, Software, Internet Services","San Francisco, California, United States",8055,Series A,"$6,000,000",7100000,-0.2,"Developer Tools, Cloud Infrastructure, Enterprise Software, Developer APIs",01/01/2013,Operating,04/10/2014,7100000,3.61,7.1,0.807
1421,Cambridge Epigenetix,29,"Cambridge Epigenetix, University of Cambridge, European Bioinformatics Institute | EMBL-EBI, University of Arizona, Imperial College London","The University of Manchester, University of Cambridge, Imperial College London, University of East Anglia, Heidelberg University","Biotechnology, Science and Engineering, Health Care","Cambridge, Cambridgeshire, United Kingdom",8076,Series B,"$21,000,000",26500000,-0.1,"Genetics, Life Science, Health Diagnostics, Biotechnology",01/01/2012,Operating,03/14/2016,26500000,1.68,26.5,0.873
1422,Trusted Insight,23,"Corning Incorporated, Microsoft, Yahoo! Inc., Apple, CenturyLink Business for Enterprise","National Taiwan University, Williams College, New York University, University of Waterloo, Fudan University","Community and Lifestyle, Financial Services, Lending and Investments","New York, New York, United States",8094,Series A,"$5,000,000",7700000,-0.6,"FinTech, Hedge Funds, Private Social Networking, Finance, Venture Capital",01/01/2010,Operating,05/14/2015,7700000,2.52,7.7,0.838
1425,"Minio, Inc.",21,"Microsoft, Red Hat, Gluster, Sun Microsystems, SAP","Massachusetts Institute of Technology, Annamalai University, National Institute of Technology Tiruchirappalli, INSEAD, UniversitÌ© Paris-Sorbonne","Platforms, Software, Health Care, Mobile","San Francisco, California, United States",10800,Series A,"$6,000,000",11200000,-0.6,"mHealth, Health Care, iOS, Software",01/24/2013,Operating,12/18/2014,11200000,2.92,11.2,0.825
