,company_name,num_employees,past_companies,past_schools,category_groups,headquarters_location,crunchbase_rank,last_funding_type,last_funding_amount,total_funding_amount,trend_score,categories,founded_date,status,last_funding_date,total_equity_funding_amount,time_since_last_funding,funding_ratio,score
475,Hutch,268,"Hutch, Alice & Trixie, Excel Infoways Ltd, University of Denver, Comcast Cable","Bangalore University, University of Mumbai, Fashion Institute of Technology, Delhi University, The Institute of Chartered Accountants of India","Apps, Commerce and Shopping, Information Technology, Real Estate, Community and Lifestyle, Software, Consumer Goods, Internet Services, Messaging and Telecommunications, Mobile","West Hollywood, California, United States",1683,Series A,"$10,000,000",17135000,2.5,"Furniture, Lifestyle, Messaging, Apps, Home Decor, E-Commerce, Mobile",09/15/2015,Operating,07/12/2017,17135000,0.35,17.135,0.898
476,Health Catalyst,504,"Health Catalyst, Intermountain Healthcare, PeaceHealth, Allina Health, The Church of Jesus Christ of Latter-day Saints","University of Utah, Brigham Young University, University of Utah - David Eccles School of Business, Utah State University, Weber State University","Hardware, Information Technology, Consumer Electronics, Data and Analytics, Software, Health Care","Salt Lake City, Utah, United States",1687,Series E,"$70,000,000",292000025,-0.4,"Computer, Software, Analytics, Health Care, Information Technology",01/01/2008,Operating,02/29/2016,292000025,1.72,292,0.879
477,LiftIgniter,17,"Act-On Software Inc., Seagate Technology, WebEx, Neustar Inc., Henge Docks LLC","Stanford University, Princeton University, The Wharton School, Chennai Mathematical Institute, McGill University","Science and Engineering, Information Technology, Data and Analytics, Software, Artificial Intelligence","San Francisco, California, United States",1689,Series A,"$6,400,000",6450000,8.8,"Personalization, Information Technology, Predictive Analytics, Artificial Intelligence, Machine Learning",01/01/2013,Operating,08/17/2017,6450000,0.25,6.45,1.348
479,Poshmark,472,"Poshmark, Nordstrom, Kaboodle, Walmart, eBay","University of California Berkeley, San Jose State University, FIDM, University of Phoenix, University of Illinois at Urbana-Champaign","Sales and Marketing, Mobile, Advertising","Shenzhen, Guangdong, China",18128,Series B,"$30,000,000",30000000,1.6,"Mobile, Advertising, Mobile Advertising, Advertising Platforms",01/01/2010,Operating,10/28/2014,30000000,3.06,30,1.158
480,BlueVine,131,"BlueVine, Israel Defense Forces, Google, PayPal, Square","Tel Aviv University, The Hebrew University of Jerusalem, Ben-Gurion University of the Negev, San Francisco State University, The Open University of Israel",Financial Services,"Redwood City, California, United States",1706,Debt Financing,"$75,000,000",188000000,-0.6,"FinTech, Small and Medium Businesses, Finance",07/01/2013,Operating,02/28/2017,113000000,0.72,113,0.899
482,Heal,212,"Heal, Microsoft, Google, Groupon, University of California, Santa Barbara","University of California Los Angeles, University of California Berkeley, University of Southern California, University of California Santa Barbara","Data and Analytics, Software, Internet Services","San Francisco, California, United States",1742,Series B,"$27,000,000",40000000,-1.8,"Enterprise Software, Analytics, Internet",01/01/2013,Operating,05/04/2017,40000000,0.54,40,0.992
483,Porch,265,"Porch, Microsoft, ACTIVE Network, LLC, University of Washington, Luth Research","University of Washington, Western Washington University, Washington State University, Gonzaga University, University of Michigan","Commerce and Shopping, Real Estate, Data and Analytics, Software","Seattle, Washington, United States",1714,Series B,"$65,000,000",98850000,-0.7,"Home and Garden, Home Improvement, Database, Marketplace",01/01/2012,Operating,01/20/2015,98850000,2.83,98.85,0.83
484,Minted,440,"Minted, Gap Inc., IBM, Walmart eCommerce, San Francisco State University","San Francisco State University, Academy of Art University, University of California Berkeley, The Art Institute of California-San Francisco, Carnegie Mellon University","Commerce and Shopping, Media and Entertainment, Real Estate, Internet Services","San Francisco, California, United States",1718,Series D,"$38,000,000",89100000,-2.4,"Internet, Art, E-Commerce, Home Decor, Crowdsourcing",08/01/2007,Operating,10/30/2014,89100000,3.05,89.1,0.823
486,Qubit,230,"Qubit., Google, BMC Software, Hootsuite, IBM","UCL, University of Bath, University of Oxford, General Assembly, University of Leeds","Commerce and Shopping, Media and Entertainment, Information Technology, Data and Analytics, Sales and Marketing, Internet Services, Content and Publishing, Advertising","London, England, United Kingdom",1730,Series C,"$40,000,000",74850000,-1,"Advertising, Internet, Data Mining, E-Commerce, Analytics, Publishing, Big Data",01/01/2010,Operating,02/22/2016,74850000,1.74,74.85,0.872
487,Percolate,271,"Percolate Inc., NetSuite, Oracle, GLG (Gerson Lehrman Group), Bloomberg LP","New York University, General Assembly, University of California Berkeley, Columbia University in the City of New York, University of California Los Angeles","Media and Entertainment, Data and Analytics, Software, Sales and Marketing, Internet Services","New York, New York, United States",1733,Series C,"$40,000,000",74500000,-0.7,"Analytics, Enterprise Software, Content, Social Media, SEO",01/01/2011,Operating,05/14/2015,74500000,2.52,74.5,0.84
488,Reflektive,118,"SAP SuccessFactors, Reflektive, Oracle, University of California, Berkeley, Disney Consumer Products and Interactive","University of California Berkeley, University of Colorado Boulder, Cornell University, California Polytechnic State University-San Luis Obispo, San Francisco State University",Data and Analytics,"San Francisco, California, United States",1735,Series B,"$25,000,000",41600000,-0.9,"SaaS, Analytics, Human Resources",01/01/2014,Operating,01/26/2017,41600000,0.81,41.6,1.233
489,Postmates,2063,"Postmates, Yelp, Starbucks, Target, Microsoft","San Francisco State University, City College of San Francisco, University of California Berkeley, Long Beach City College, Santa Monica College","Food and Beverage, Administrative Services, Transportation","San Francisco, California, United States",1750,Series D,"$140,000,000",278010000,-2.8,"Logistics, Delivery, Transportation, Food Delivery, Same Day Delivery",03/01/2011,Operating,09/16/2016,278010000,1.17,278.01,0.896
490,uBiome,115,"Globant, uBiome, Groupon, Pontificia Universidad Católica de Chile, Despegar.com","Pontificia Universidad Católica de Chile, Universidad de Chile, Universidad Nacional de La Plata, Universidad Nacional  Andrés Bello, Universidad Técnica Federico Santa María","Biotechnology, Data and Analytics, Software, Health Care, Artificial Intelligence","San Francisco, California, United States",1756,Series B,"$22,000,000",26971193,2.3,"Health Care, Machine Learning, Quantified Self",01/01/2012,Operating,11/01/2016,26971193,1.04,26.971,0.892
491,Mirakl,136,"Mirakl, CSC, Groupon, Fnac, Pixmania","ESSEC Business School, NEOMA Business School, ESCP Europe, HEC Paris, EDHEC Business School","Commerce and Shopping, Software, Internet Services","Paris, Ile-de-France, France",1761,Series B,"$20,000,000",23000000,2.1,"Marketplace, SaaS, Internet, Software",02/14/2012,Operating,07/22/2015,23000000,2.33,23,0.846
493,Mintigo,75,"Mintigo, Israel Defense Forces, Microsoft, LivePerson, Hewlett Packard Enterprise","Tel Aviv University, Bar-Ilan University, Ben-Gurion University of the Negev, Technion - Israel Institute of Technology, The Hebrew University of Jerusalem",Transportation,"Bengaluru, Karnataka, India",42739,Series A,"$10,000,000",10000000,-1.5,Fleet Management,03/01/2015,Operating,05/02/2017,10000000,0.55,10,0.897
494,Farmers Business Network,126,"Farmer's Business Network Inc., Adobe, John Deere, US Army, Dow AgroSciences","Iowa State University, Purdue University, North Dakota State University, South Dakota State University, University of California Davis","Agriculture and Farming, Science and Engineering, Hardware, Data and Analytics, Software, Internet Services","San Carlos, California, United States",1776,Series C,"$40,000,000",83900000,-0.7,"Analytics, Agriculture, Robotics, Farming, Big Data, Social Network",01/01/2014,Operating,03/07/2017,83900000,0.7,83.9,0.898
495,Avvo,415,"Avvo, Microsoft, Expedia Inc., Amazon, Washington State University","University of Washington, Washington State University, Western Washington University, Seattle University, University of Washington - Michael G. Foster School of Business","Commerce and Shopping, Professional Services","Seattle, Washington, United States",1782,Series E,"$71,500,000",132000000,-1.8,"Legal, Marketplace, Consulting",01/01/2006,Operating,07/28/2015,132000000,2.31,132,0.85
496,PillPack,284,"CVS Health, PillPack, Walgreens, RITE AID, Alliance Health, LLC","Massachusetts College of Pharmacy and Health Sciences, University of New Hampshire, Northeastern University, University of Utah, Southern New Hampshire University","Health Care, Internet Services","Cambridge, Massachusetts, United States",1783,Series D,"$55,000,000",117800000,-1.1,"Pharmaceutical, Hospital, Health Care, Internet",01/31/2013,Operating,09/06/2016,117800000,1.2,117.8,0.891
497,Leanplum,143,"Leanplum, Musala Soft, Google, Apple, Upsight","Sofia University St. Kliment Ohridski, San Francisco State University, University of California Berkeley, University of California Santa Cruz, Santa Clara University","Apps, Commerce and Shopping, Data and Analytics, Software, Sales and Marketing, Mobile","San Francisco, California, United States",1785,Series C,"$29,000,000",46325000,-1.3,"Apps, Analytics, E-Commerce, Marketing Automation, Mobile",01/01/2012,Operating,10/18/2016,46325000,1.08,46.325,0.892
498,BankBazaar.com,597,"BankBazaar.com, Standard Chartered Bank, Amazon, HCL Technologies, Microsoft","Anna University, University of Madras, Christ University, Bangalore, Kendriya Vidyalaya, Visvesvaraya Technological University","Commerce and Shopping, Financial Services","Chennai, Tamil Nadu, India",1787,Series Unknown,"₹50,000,000",79750452,2.9,"Insurance, Finance, Marketplace, E-Commerce",07/01/2008,Operating,09/27/2016,79750452,1.14,79.75,0.797
499,Sourcepoint,26,"Google, Admeld, Bloomberg LP, Amazon, AppNexus","Massachusetts Institute of Technology, University of Michigan, App Academy, University of Maryland College Park, Rice University","Manufacturing, Media and Entertainment, Internet Services, Content and Publishing","New York, New York, United States",1788,Series B,"$16,000,000",26000000,4.1,"Search Engine, Manufacturing, Publishing, Content",06/01/2015,Operating,01/25/2017,26000000,0.81,26,0.903
500,Carbon,326,"Tesla, Carbon, Stanford University, University of North Carolina at Chapel Hill, Velocity11","Stanford University, University of North Carolina at Chapel Hill, University of California Berkeley, Massachusetts Institute of Technology, University of California Davis","Manufacturing, Science and Engineering, Hardware, Software","Redwood City, California, United States",1796,Series C,"$81,000,000",222000000,-0.6,"Mechanical Engineering, Manufacturing, Robotics, 3D Printing, Industrial Engineering",01/01/2013,Operating,09/15/2016,222000000,1.17,222,1.344
503,Maven Clinic,129,"Bank of America, Icahn School of Medicine at Mount Sinai, New York-Presbyterian Hospital, Rent The Runway, Montefiore Health System","New York University, University of Pennsylvania, Georgetown University, Hunter College, Santa Clara University",Health Care,"Beijing, Beijing, China",13121,Series C,"$70,000,000",110000000,2.5,"Health Care, Medical, Dental",01/01/2000,Operating,04/19/2014,110000000,3.58,110,0.811
504,Doctor On Demand,233,"vRad (Virtual Radiologic), Castlight Health, PayPal, Doctor On Demand, Benefitfocus","Stanford University, New York University, University of Phoenix, San Jose State University, University of California Berkeley","Hardware, Information Technology, Software, Health Care","San Francisco, California, United States",1807,Series B,"$62,749,919",86749919,-1.1,"Hospital, Health Care, Virtualization",10/01/2012,Operating,07/20/2015,86749919,2.33,86.75,1.298
505,Greenhouse Software,220,"Greenhouse Software, Amherst College, Epic, eChalk, LinkedIn","New York University, University of Michigan, Duke University, Rutgers University, General Assembly","Software, Professional Services","New York, New York, United States",1811,Series C,"$35,000,000",60130270,-0.8,"Software, B2B, Enterprise Software, Recruiting, SaaS",01/01/2012,Operating,08/24/2015,60130270,2.24,60.13,0.851
507,EverString,118,"EverString, Oracle, ADP, Marketo, CEB, now Gartner","San Francisco State University, Tsinghua University, Zhejiang University, California Polytechnic State University-San Luis Obispo, University of California Berkeley","Media and Entertainment, Music and Audio, Internet Services, Video",,26752,Series C,"$8,250,000",23250000,0.7,"Video, Search Engine, Audio",,Operating,05/12/2009,23250000,8.52,23.25,0.78
508,Clara Labs,35,"Amgen, Apple, Marist College, Startup Shell, IBM","Silliman University, The University of Texas at Austin, Rice University, Texas Woman's University, Kaplan University","Information Technology, Software, Internet Services, Messaging and Telecommunications","San Francisco, California, United States",1822,Series A,"$7,000,000",12000000,-0.1,"Meeting Software, Email, Task Management",02/19/2014,Operating,07/19/2017,12000000,0.33,12,0.898
511,Kahuna,60,"Oracle, Salesforce, Yahoo! Inc., Adobe, IBM","San Jose State University, Stanford University, University of Illinois at Urbana-Champaign, University of California Davis, University of Michigan","Hardware, Consumer Electronics, Data and Analytics, Software, Sales and Marketing, Internet Services, Mobile","Redwood City, California, United States",1838,Series B,"$45,000,000",58000000,-0.7,"Software, Marketing Automation, Mobile, Analytics, Internet, Computer",01/01/2011,Operating,08/19/2015,58000000,2.25,58,0.85
512,Button,11,"Caesars Palace, SK+G, Best Buy, Unicover, Sunrise Enterprises","University of North Texas, University of Wyoming","Apps, Software, Sales and Marketing, Mobile, Advertising","New York, New York, United States",1847,Series B,"$20,000,000",34550000,-1.3,"Affiliate Marketing, Mobile, Mobile Apps, Enterprise Software",05/01/2014,Operating,01/25/2017,34550000,0.81,34.55,1.177
513,Harry's,97,"NEOMA Business School, Palladium Hotel Group, Family, Career and Community Leaders of America, Peter Knipp Holdings, Unilever","RMIT University, Universitat Oberta de Catalunya, Ecole supérieure de Commerce de Reims, Rennes School of Business, NEOMA Business School","Commerce and Shopping, Community and Lifestyle, Clothing and Apparel, Design","New York, New York, United States",1856,Series C,"$75,600,000",287100001,-0.3,"Lifestyle, Price Comparison, Fashion, E-Commerce",10/01/2011,Operating,07/07/2015,287100001,2.37,287.1,0.852
514,VSCO,113,"VSCO®, PwC, Linden Lab, Verve Coffee Roasters, Facebook","University of California San Diego, University of California Berkeley, UC Irvine, University of Southern California, University of Illinois at Urbana-Champaign","Media and Entertainment, Software, Internet Services, Content and Publishing, Mobile","Oakland, California, United States",1860,Series B,"$30,000,000",70000000,2.3,"Photo Editing, Mobile, Software, Internet, Photography",03/31/2011,Operating,04/24/2015,70000000,2.57,70,0.838
515,Conduit,285,"Conduit, Microsoft, Intel Corporation, 888holdings, Amdocs","Tel Aviv University, Ben-Gurion University of the Negev, Bar-Ilan University, The Open University of Israel, University of Michigan","Software, Internet Services","Ness Ziona, HaMerkaz, Israel",1865,Private Equity,"$100,000,000",109800000,5.1,"Enterprise Software, Cloud Computing, Online Portals",01/01/2005,Operating,04/12/2012,109800000,5.6,109.8,0.789
516,ResearchGate,291,"ResearchGate, Atheneum, ExxonMobil, VZnet Ltd, LinkedIn","Humboldt University of Berlin, Freie Universität Berlin, Technische Universität Berlin, Jacobs University Bremen, Universität Passau","Media and Entertainment, Community and Lifestyle, Professional Services, Internet Services","Berlin, Berlin, Germany",1871,Series D,"$52,600,000",87600000,-1,"Internet, Social Media, Professional Networking",05/01/2008,Operating,02/28/2017,87600000,0.72,87.6,0.898
517,Riskified,186,"Israel Defense Forces, Riskified, Israeli Defense Forces (IDF), Tel Aviv University, Australian Government","Tel Aviv University, The Hebrew University of Jerusalem, Ben-Gurion University of the Negev, Bar-Ilan University, The Academic College of Tel-Aviv, Yaffo","Commerce and Shopping, Data and Analytics, Software, Payments, Privacy and Security, Financial Services, Artificial Intelligence","Tel Aviv, Tel Aviv, Israel",1872,Series C,"$33,000,000",63650000,-1.8,"FinTech, Risk Management, E-Commerce, Machine Learning, Fraud Detection",01/01/2012,Operating,06/27/2017,63650000,0.39,63.65,0.806
518,Qumulo,157,"Microsoft, Dell EMC, EMC Isilon, NetApp, Amazon","University of Washington, University of Illinois at Urbana-Champaign, Western Washington University, University of Washington - Michael G. Foster School of Business, Washington State University","Hardware, Data and Analytics, Software","Seattle, Washington, United States",1880,Series C,"$30,000,000",129300000,-0.1,"Enterprise Software, Big Data, Data Storage",01/01/2012,Operating,04/04/2017,129300000,0.62,129.3,0.9
519,SteelHouse,197,"SteelHouse, Leaf Group, FetchBack Inc., Yahoo! Inc., Google","University of California Los Angeles, Loyola Marymount University, University of Southern California, University of California Santa Barbara, California State University-Long Beach","Data and Analytics, Sales and Marketing, Advertising","Culver City, California, United States",1884,Convertible Note,,64800000,-1.5,"Real Time, Analytics, Advertising",05/01/2009,Operating,05/19/2017,64800000,0.5,64.8,0.899
520,Kenshoo,557,"Kenshoo, Hewlett Packard Enterprise, Oracle, iProspect, Google","Tel Aviv University, Ben-Gurion University of the Negev, Technion - Israel Institute of Technology, The Hebrew University of Jerusalem, The Academic College of Tel-Aviv, Yaffo","Sales and Marketing, Advertising","Tel Aviv, Tel Aviv, Israel",1886,Series F,"$20,000,000",49660149,-0.4,"Advertising, Mobile Advertising, Marketing, Social Media Advertising",01/01/2006,Operating,04/08/2014,49660149,3.61,49.66,0.715
521,SkySafe,13,"Lockheed Martin, US Navy, Qualcomm, Northrop Grumman, University of Oklahoma","University of California San Diego, Massachusetts Institute of Technology, University of Oklahoma, University of Pittsburgh, Universidad de Córdoba","Science and Engineering, Hardware, Consumer Electronics, Software, Consumer Goods, Privacy and Security","San Diego, California, United States",1893,Series A,"$11,500,000",14500000,5.3,"Drone Management, Robotics, Security, Drones, Aerospace",01/01/2015,Operating,07/20/2017,14500000,0.33,14.5,0.898
522,Near,123,"Near, InMobi, Theorem, IBM, Microsoft","The Institute of Chartered Accountants of India, University of Pune, Visvesvaraya Technological University, Waseda University, Universidad Politécnica de Madrid","Science and Engineering, Navigation and Mapping, Data and Analytics, Software, Sales and Marketing, Internet Services, Artificial Intelligence","Singapore, Central Region, Singapore",1902,Series B,"$19,000,000",25500000,-1.8,"Artificial Intelligence, Digital Marketing, Location Based Services, Analytics, SaaS",11/01/2012,Operating,10/15/2014,25500000,3.09,25.5,0.82
523,Gerson Lehrman Group (GLG),4923,"GLG (Gerson Lehrman Group), PepsiCo, IBM, Procter & Gamble, Merck","The University of Texas at Austin, The Wharton School, University of Virginia, FGV - Fundação Getulio Vargas, University of Pennsylvania","Commerce and Shopping, Information Technology, Real Estate, Professional Services, Financial Services","New York, New York, United States",1904,Private Equity,"$212,000,000",212000000,1.2,"Real Estate, Retail, Accounting, Information Services",01/01/1998,Operating,12/21/2015,212000000,1.91,212,1.019
525,HireVue,243,"HireVue, Brigham Young University, ADP, Taleo, CareerBuilder","University of Utah, Brigham Young University, Salt Lake Community College, Utah Valley University, Utah State University","Media and Entertainment, Software, Professional Services, Education, Video","South Jordan, Utah, United States",1911,Series E,"$45,000,000",93000000,-1.2,"Human Resources, Video, Software, Recruiting, SaaS, Corporate Training",04/01/2004,Operating,06/02/2015,93000000,2.46,93,0.843
527,Tune,363,"TUNE, Microsoft, Amazon, Nordstrom, University of Washington","University of Washington, Western Washington University, Code Fellows, University of Washington - Michael G. Foster School of Business, Art Institute of Seattle","Platforms, Media and Entertainment, Music and Audio, Software, Mobile","Santa Monica, California, United States",28006,Series B,"$7,000,000",10000000,0,"Mobile, Music, Android, Developer Tools, iOS",12/01/2007,Operating,02/08/2010,10000000,7.78,10,0.78
528,UberMedia,76,"UberMedia, Idealab, Initiative, Forbes, Infosys","University of California Los Angeles, University of Southern California, The University of Kansas, Caltech, Stanford University","Media and Entertainment, Sales and Marketing, Internet Services, Mobile, Advertising","Pasadena, California, United States",1920,Series Unknown,"$8,000,000",34600000,-0.1,"Mobile, Advertising Platforms, Mobile Advertising, Marketing, Advertising, Social Media",03/01/2010,Operating,05/05/2014,34600000,3.54,34.6,0.809
529,YapStone,403,"YapStone, PayPal, Visa, Wells Fargo, American Express","San Francisco State University, California State University - East Bay, San Jose State University, Saint Mary's College of California, University of California Berkeley","Software, Payments, Financial Services, Mobile","Walnut Creek, California, United States",1925,Debt Financing,"$60,000,000",115400000,-0.6,"FinTech, Financial Services, Mobile Payments, Payments, Finance",01/01/1999,Operating,03/31/2015,55400000,2.64,55.4,0.835
530,Remix,114,"Microsoft, Code for America, LinkedIn, Omada Health, California Polytechnic State University","Massachusetts Institute of Technology, Brown University, University of California Berkeley, University of Oxford, Universidad de La Rioja","Information Technology, Government and Military, Transportation","San Francisco, California, United States",1928,Series A,"$10,000,000",12000000,-3.7,"Public Transportation, Transportation, Information Technology, GovTech",10/31/2014,Operating,05/09/2017,12000000,0.53,12,0.898
531,Paperless Post,128,"Paperless Post, Gilt.com, Vistaprint, Lime Company, Microsoft","New York University, Harvard University, Columbia University in the City of New York, Fashion Institute of Technology, Brown University","Commerce and Shopping, Media and Entertainment, Internet Services, Content and Publishing","New York, New York, United States",1931,Secondary Market,,32350000,4,"Printing, Internet, E-Commerce",09/01/2008,Operating,09/09/2014,32350000,3.19,32.35,0.817
532,"ChargePoint, Inc.",345,"ChargePoint Inc., Pace, 2Wire, Oracle, Cisco","San Jose State University, Stanford University, California State University Chico, University of California Berkeley, University of California Davis","Energy, Hardware, Sustainability, Data and Analytics, Software, Transportation, Internet Services","Campbell, California, United States",1933,Series G,"$43,000,000",292199763,-2.7,"GreenTech, Internet of Things, Big Data, Software, Electric Vehicle, SaaS, Clean Energy, Energy Management, Hardware",01/01/2007,Operating,06/28/2017,291200000,0.39,291.2,0.906
533,Grand Rounds,289,"Grand Rounds Inc., Aon Hewitt, PayPal, Kaiser Permanente, Mercer","University of Nevada, Reno, University of California Berkeley, Stanford University, University of Washington, Northwestern University",Health Care,"San Francisco, California, United States",1934,Series C,"$55,000,000",106000000,-0.7,"Medical, Health Care, Health Diagnostics",01/01/2011,Operating,08/20/2015,106000000,2.25,106,0.758
534,AgilOne,115,"AgilOne, Oracle, Bank of America, Hewlett Packard Enterprise, Badgeville","University of the Philippines, École nationale des ponts et chaussées, University of Illinois at Urbana-Champaign, CentraleSupelec, HEC Paris","Data and Analytics, Sales and Marketing, Advertising","Mountain View, California, United States",1940,Series C,"$25,000,016",41000016,4.8,"SaaS, Marketing, Analytics, Big Data, Business Intelligence, Advertising",01/01/2006,Operating,04/15/2014,41000016,3.59,41,0.808
535,Zipline,48,"PowerPay, S&H Solutions, ZipLine, Health Dialog, Thermo Fisher Scientific","University of New Hampshire Peter T. Paul College of Business and Economics, Florida International University, Florida State University, Boston University, Full Sail University","Science and Engineering, Hardware, Consumer Electronics, Software, Transportation, Consumer Goods","San Francisco, California, United States",1941,Series B,"$25,000,000",41114796,-1.1,"Drones, Logistics, Robotics",08/01/2011,Operating,11/09/2016,41114796,1.02,41.115,0.893
536,Vungle,212,"Vungle, Mode Media Corporation (formerly Glam Media), Zynga, Fyber, Apple","University of California Berkeley, San Francisco State University, University of San Francisco, University of California Berkeley Haas School of Business, McGill University","Media and Entertainment, Software, Sales and Marketing, Video, Mobile, Advertising","San Francisco, California, United States",1944,Series B,"$17,000,000",25500000,-2.1,"Mobile Advertising, Mobile, Video, Developer Tools",01/01/2011,Operating,02/06/2014,25500000,3.78,25.5,1.142
