,company_name,num_employees,past_companies,past_schools,category_groups,headquarters_location,crunchbase_rank,last_funding_type,last_funding_amount,total_funding_amount,trend_score,categories,founded_date,status,last_funding_date,total_equity_funding_amount,time_since_last_funding,funding_ratio,score
916,New Dada,38,"Anjuke Inc., Deutsche Bank, Goldensearches, Baidu Inc., IBM","Hohai University Wentian College, Anhui University, Anhui University of Finance and Economics, Chengdu University of Technology, Fudan University","Apps, Software, Transportation, Internet Services, Mobile","Shanghai, Shanghai, China",3831,Funding Round,"$50,000,000",450000000,-0.3,"Mobile Apps, Mobile, Logistics, Internet",01/01/2014,Operating,10/20/2016,450000000,1.08,450,0.903
917,Brighter.com,5,"Kablelink Communications, Domo Tactical Communications (DTC), United States Air Force, Hillsborough Community College, Vitera Healthcare Solutions","University of Tampa, Indiana State University, Hillsborough Community College","Commerce and Shopping, Health Care, Internet Services","Santa Monica, California, United States",3837,Series D,"$21,000,000",49000000,-0.1,"Marketplace, Internet, Dental",01/01/2011,Operating,04/20/2016,49000000,1.58,49,1.064
918,Dropbox,2236,"Dropbox, Google, Microsoft, Oracle, Facebook","Stanford University, University of California Berkeley, Massachusetts Institute of Technology, The University of Texas at Austin, Carnegie Mellon University","Hardware, Information Technology, Software, Internet Services","San Francisco, California, United States",3848,Debt Financing,"$600,000,000",1707215000,-5.7,"Web Hosting, Enterprise Software, Collaboration, Private Cloud, File Sharing",06/01/2007,Operating,03/30/2017,607215000,0.64,607.215,1.371
919,Wag,70438,"Walgreens, Walmart, CVS Health, Target, CVS Pharmacy","University of Illinois at Chicago, University of Phoenix, Massachusetts College of Pharmacy and Health Sciences, University of Wisconsin-Madison, Purdue University","Apps, Community and Lifestyle, Software","San Francisco, California, United States",3864,Series B,,8900000,-1.3,"Crowdsourcing, Apps, Pet",10/01/2014,Operating,03/31/2017,8900000,0.63,8.9,0.897
921,Rockets of Awesome,51,"J.Crew, Warby Parker, Macy's, Kohl's Department Stores, Gap Inc.","Fashion Institute of Technology, New York University, University of Cincinnati, Harvard Business School, Universidade do Porto","Media and Entertainment, Video","Mumbai, Maharashtra, India",8717,Series Unknown,"$3,000,000",3000000,-0.3,"Digital Entertainment, Video, Digital Media",12/01/2013,Operating,12/15/2016,3000000,0.92,3,0.893
922,POPSUGAR,598,"POPSUGAR, Condé Nast, Apple, Hearst Magazines, Viacom","New York University, University of Southern California, University of California Santa Barbara, University of Michigan, University of California Berkeley","Commerce and Shopping, Community and Lifestyle, Sports, Clothing and Apparel, Consumer Goods, Design","San Francisco, California, United States",3882,Series Unknown,"$15,000,000",46000000,-3,"Fitness, Beauty, Fashion, Shopping, Lifestyle",04/01/2006,Operating,04/12/2011,46000000,6.61,46,0.784
923,Aquantia,218,"Aquantia, Intel Corporation, Marvell Semiconductor, Centillium Communications, NXP Semiconductors","State University of Nizhni Novgorod named after N.I. Lobachevsky (UNN), Stanford University, Santa Clara University, University of Toronto, San Jose State University","Science and Engineering, Hardware, Consumer Electronics, Mobile","Milpitas, California, United States",3888,Series H,"$37,000,000",185624633,1.4,"Electronics, Semiconductor, Mobile",01/01/2004,Operating,04/10/2015,185624633,2.61,185.625,0.84
924,Verge Genomics,15,"Stanford University, University of California, Los Angeles, Verge Genomics, Regeneron Pharmaceuticals Inc., University of California, Davis","University of California Los Angeles, Stanford University, Princeton University, University of Oregon, TU Dortmund University","Biotechnology, Health Care","San Francisco, California, United States",3899,Seed,"$4,000,000",4000000,0.7,"Genetics, Health Care",01/01/2015,Operating,10/29/2015,4000000,2.05,4,0.857
925,Metabiota,106,"Metabiota, AIR Worldwide, RMS, Wildlife Conservation Society, Centers for Disease Control and Prevention","University of California Berkeley, University of California Davis, University of Victoria, George Mason University, Vancouver Island University",Data and Analytics,"San Francisco, California, United States",3902,Series B,,33800000,-0.4,"Risk Management, Big Data, Analytics",01/01/2008,Operating,02/25/2017,33800000,0.73,33.8,1.234
926,Envoy,6,"Azure Production, Xerox, STAPLES Canada, marblemedia","Centennial College, Durham College","Software, Internet Services, Privacy and Security","San Francisco, California, United States",3914,Series Unknown,"$4,162,064",20312064,-1,"Security, Software, Cloud Storage, Human Resources",02/01/2013,Operating,05/04/2016,20312064,1.54,20.312,1.159
927,Moglix,182,"Tata Steel, Snapdeal, Moglix, Tolexo Online Pvt. Ltd., AskmeBazaar","Uttar Pradesh Technical University, Asia Pacific Institute Of Management, Delhi University, Guru Gobind Singh Indraprastha University, Kendriya Vidyalaya","Commerce and Shopping, Mobile","Noida, Uttar Pradesh, India",3916,Series B,"$12,000,000",16205943,7,"Mobile, B2B, E-Commerce",01/01/2015,Operating,07/06/2017,16205943,0.37,16.206,0.898
928,Druva,422,"Druva, Symantec, BMC Software, Dell EMC, Persistent Systems","University of Pune, San Jose State University, Pune Institute of Computer Technology, Indian Institute of Technology Bombay, Indian Institute of Technology Kanpur","Hardware, Information Technology, Software, Professional Services, Internet Services","Sunnyvale, California, United States",3917,Series Unknown,"$80,000,000",198000000,5,"Cloud Data Services, Enterprise Software, Data Storage, Compliance",08/02/2008,Operating,08/22/2017,198000000,0.24,198,0.904
929,LimeRoad,385,"Limeroad.com, FashionAndYou.com, ShopClues, Jabong, PolicyBazaar.com","Delhi University, National Institute of Fashion Technology, Netaji Subhas Institute of Technology, Kendriya Vidyalaya, Punjab Technical University","Commerce and Shopping, Media and Entertainment, Clothing and Apparel, Internet Services, Design","Gurgaon, Haryana, India",3927,Series C,"$30,000,000",50000000,-0.9,"E-Commerce, Shopping, Internet, Social Media, Fashion",01/01/2012,Operating,03/30/2015,50000000,2.64,50,0.835
930,Walker & Company Brands,32,"Citi, AOL, Walker & Company Brands Inc., Cisco, Target","San Jose State University, Stanford University Graduate School of Business, Harvard Business School, Cornell University, New York University","Commerce and Shopping, Health Care, Consumer Goods","Palo Alto, California, United States",3930,Series B,"$24,000,000",33300000,-1.4,"Beauty, Health Care, Retail",04/18/2013,Operating,09/28/2015,33300000,2.14,33.3,0.854
931,Tapingo,255,"Tapingo, Israel Defense Forces, Lonely Planet, eBay, Yelp","University of Arizona, University of Arkansas, California State University Chico, University of California Berkeley, Santa Clara University","Apps, Commerce and Shopping, Software, Mobile","Tel Aviv, Tel Aviv, Israel",3931,Series C,"$22,000,000",36000000,-0.7,"Consumer, E-Commerce, Apps, Mobile",01/01/2012,Operating,04/02/2015,36000000,2.63,36,0.835
932,Bellhops,495,"Bellhops, Covenant College, The University of Tennessee at Chattanooga, Groupon, Lowe's Companies Inc.","The University of Tennessee at Chattanooga, University of Tennessee, Knoxville, University of North Carolina at Charlotte, Virginia Commonwealth University, Covenant College",Professional Services,"Chattanooga, Tennessee, United States",3932,Debt Financing,"$6,000,000",27200000,-0.4,"Employment, Service Industry",01/01/2012,Operating,04/05/2017,21200000,0.62,21.2,0.804
934,Crunchbase,74,"Salesforce, Crunchbase, Dropbox, LinkedIn, Google","University of California Berkeley, University of California Los Angeles, The University of Chicago, University of California Davis, University of Michigan","Data and Analytics, Community and Lifestyle, Financial Services, Lending and Investments","San Francisco, California, United States",3936,Series B,"$18,000,000",26500000,-4.5,"Venture Capital, Analytics, Communities, Business Intelligence, FinTech, Big Data",07/01/2007,Operating,04/06/2017,26500000,0.62,26.5,1.235
935,People.ai,32,"Responsys, Dell, Postindustria, Lexalytics Inc., Marketo","Télécom ParisTech, California State University Chico, University of California Berkeley Haas School of Business, Vanderbilt University, The University of Texas at Austin","Science and Engineering, Data and Analytics, Software, Sales and Marketing, Artificial Intelligence","San Francisco, California, United States",3939,Series A,"$7,000,000",7120000,-1.9,"Artificial Intelligence, Machine Learning, Predictive Analytics, Sales",01/01/2016,Operating,05/30/2017,7120000,0.47,7.12,0.898
936,Fundera,65,"Fundera, Yelp, Irwin Union Bank, LivingSocial, Gilt.com","Columbia University in the City of New York, New York University, Amherst College, General Assembly, University of the Philippines","Internet Services, Financial Services","New York, New York, United States",3952,Series B,"$15,500,000",18900000,-0.3,"Internet, Lending, Financial Services",10/01/2013,Operating,09/17/2015,18900000,2.17,18.9,1.115
937,Space Ape,129,"Electronic Arts (EA), Space Ape Games, Playfish, Mind Candy, Microsoft","University of Hertfordshire, Bournemouth University, University of Warwick, University of Cambridge, Delft University of Technology","Gaming, Mobile","London, England, United Kingdom",3959,Debt Financing,"£4,250,000",21007030,-1.4,"Mobile, Video Games, Gaming",01/01/2012,Operating,05/13/2015,14350075,2.52,14.35,0.839
938,Yottaa,64,"Endeca, PTC, Yottaa, Oracle, AG Salesworks","Boston University, University of Massachusetts Lowell, Beijing University of Posts and Telecommunications, Tianjin Polytechnic University, Tsinghua University","Commerce and Shopping, Software, Internet Services, Content and Publishing","Waltham, Massachusetts, United States",3969,Series Unknown,"$13,000,000",52445469,0,"Content Delivery Network, Enterprise Software, E-Commerce Platforms, Internet",04/01/2009,Operating,11/15/2016,52445469,1.01,52.445,0.893
941,Solarflare Communications,190,"Solarflare Communications, Adaptec is now Microsemi, Entropic Communications, BT, Broadcom Limited","University of Cambridge, UC Irvine, California State University Fullerton, University of Oxford, San Diego State University",Mobile,"Tel Aviv, Tel Aviv, Israel",45559,Series Unknown,"$5,000,000",5000000,-0.2,Mobile,01/01/2004,Operating,11/11/2007,5000000,10.02,5,0.778
942,Agrivida,36,"Massachusetts Institute of Technology, Monsanto Company, Syngenta, Agrivida Inc., Plymouth Energy, LLC","University of Massachusetts Amherst, Iowa State University, University of Illinois at Urbana-Champaign, Boston University, Worcester Polytechnic Institute","Biotechnology, Natural Resources, Science and Engineering, Energy, Sustainability","Cambridge, Massachusetts, United States",3980,Series Unknown,,64798233,1.2,"Biomass Energy, Biotechnology, Biofuel",01/01/2002,Operating,02/09/2017,61548733,0.77,61.549,0.897
943,Prism Skylabs,57,"Viewdle, Prism Skylabs, Motorola Mobility (a Lenovo Company), Cisco, CA Technologies","National Technical University of Ukraine 'Kyiv Polytechnic Institute'​, Kiev National Taras Shevchenko University, Occidental College, University of California Berkeley, Pontificia Universidad Católica del Perú","Science and Engineering, Hardware, Commerce and Shopping, Media and Entertainment, Data and Analytics, Software, Video, Privacy and Security, Artificial Intelligence","San Francisco, California, United States",3983,Series B,"$15,000,000",23999700,-0.3,"Enterprise Software, Security, Retail, Business Intelligence, Artificial Intelligence, Analytics, Video, Computer Vision, Machine Learning",07/01/2011,Operating,10/22/2013,23999700,4.07,24,0.8
944,Thanx,66,"Thanx, Oracle, Yelp, Groupon, Intuit","Dartmouth College, Universitat Autònoma de Barcelona, Colorado State University, University of Missouri-Columbia, University of Tasmania","Sales and Marketing, Mobile","San Francisco, California, United States",3989,Series B,"$17,100,000",23100000,-0.8,"Loyalty Programs, Mobile",01/01/2012,Operating,12/08/2016,23100000,0.94,23.1,0.894
945,SmartDrive Systems,333,"Qualcomm, SmartDrive Systems, ACTIVE Network, LLC, Comdata, Rand McNally","San Diego State University, University of California San Diego, Osmania University, The Ohio State University, Andhra University","Information Technology, Data and Analytics, Government and Military","San Diego, California, United States",4001,Series Unknown,"$50,000,000",180200887,0,"Information Technology, Analytics, Public Safety",01/01/2004,Operating,03/30/2015,180200887,2.64,180.201,0.839
946,Mobcrush,26,"Microsoft, Twitter, Spatial View Inc., Machinima, Yahoo! Inc.","University of Southern California, University of Michigan, University of Mumbai, National University of Singapore, University of California Santa Barbara","Gaming, Platforms, Media and Entertainment, Software, Video, Content and Publishing, Mobile","Santa Monica, California, United States",4005,Series B,"$20,000,000",35900000,-0.7,"Android, Gaming, Mobile, Video Streaming, iOS",01/01/2014,Operating,10/25/2016,35900000,1.06,35.9,1.042
947,Riley,25,"DayMen Acquisition S.A., DayMen International Ltd, DayMen Group, McCann, Clarke & Associates","University of Guelph, Bournemouth University, Sheridan College","Information Technology, Software, Sales and Marketing","San Francisco, California, United States",4013,Seed,"$3,100,000",3100000,-1.2,"Lead Management, Sales Automation, Information Services",03/01/2016,Operating,04/03/2017,3100000,0.62,3.1,1.084
948,Innovium Inc,28,"Broadcom Limited, Cavium Inc, Intel Corporation, Sun Microsystems, Cisco","Indian Institute of Technology Delhi, Indian Institute of Technology Kanpur, Visvesvaraya Technological University, University of Southern California, Purdue University","Hardware, Information Technology, Software, Design","San Jose, California, United States",4017,Series C,"$38,300,000",88300000,-0.6,"Information Technology, Hardware, Product Design, Software",12/18/2014,Operating,03/14/2017,88300000,0.68,88.3,0.899
949,Bonfire Studios,4,"DreamWorks Animation, Improving, Riot Games, Respawn Entertainment, Bank of America","University of Phoenix, School of the Art Institute of Chicago, The University of Texas at Austin",Gaming,"Irvine, California, United States",4018,Series Unknown,"$25,000,000",25000000,1.2,"Gamification, Online Games, Gaming",03/03/2016,Operating,09/12/2016,25000000,1.18,25,1.076
950,Gigwalk,40,"Gameloft, Gigwalk, Apple, Microsoft, AT&T","Indian Institute of Technology Kharagpur, National Taiwan University, V. N. Karazin Kharkiv National University, Stanford University, University of Massachusetts Amherst","Commerce and Shopping, Navigation and Mapping, Data and Analytics, Internet Services, Mobile","San Francisco, California, United States",4023,Series B,"$10,100,000",17800000,-0.5,"Crowdsourcing, Location Based Services, Retail, Internet, Mobile",08/01/2010,Operating,03/20/2014,17800000,3.67,17.8,0.806
951,Juicero,144,"Juicero, Fresh & Easy, Apple, The OutCast Agency, Odwalla","University of California Berkeley, University of California Davis, San Francisco State University, Stanford University, University of California San Diego","Food and Beverage, Health Care","San Francisco, California, United States",4027,Series C,"$28,000,000",118500000,-0.1,"Nutrition, Food and Beverage, Organic Food",01/01/2013,Operating,04/01/2016,118500000,1.63,118.5,1.215
952,HYLA Mobile,127,"Sprint, Asurion, RadioShack, HYLA Mobile - Extending the Life Cycle of Mobile Devices, Smith Micro Software Inc.","University of North Texas, Naveen Jindal School of Management, UT Dallas, The University of Kansas, Anna University, Texas A&M University","Hardware, Consumer Electronics, Mobile","Farmers Branch, Texas, United States",4034,Series C,"$105,000,000",140000000,1.7,"Mobile, Mobile Devices, Hardware",01/01/2009,Operating,10/28/2013,140000000,4.06,140,0.71
953,Cardekho,695,"CarDekho, Teleperformance, Tata Motors, Hyundai Motor India Ltd., CarTrade.com","University of Rajasthan, Delhi University, Kendriya Vidyalaya, Indian Institute of Technology Delhi, Indian Institute of Management, Calcutta","Commerce and Shopping, Information Technology, Transportation","Gurgaon, Haryana, India",4037,Series C,,65000000,-0.5,"Automotive, E-Commerce, Information Services",01/01/2005,Operating,03/21/2016,65000000,1.66,65,0.781
954,Adknowledge,77,"Adknowledge, Sprint, DST Systems, Hallmark Cards, Fox Interactive Media","Kansas State University, The University of Kansas, Truman State University, University of Missouri-Kansas City, Pittsburg State University","Apps, Media and Entertainment, Software, Sales and Marketing, Internet Services, Video, Content and Publishing, Mobile, Advertising","Kansas City, Missouri, United States",4038,Series B,"$200,000,000",262000000,-0.1,"Apps, Content Discovery, Mobile, Video, Advertising, Social Media",01/01/2004,Operating,01/12/2011,262000000,6.85,262,0.789
955,Brava Home,51,"GoPro, Playdom, Ticketmaster, Apple, 3D Robotics","Swarthmore College, University of California Berkeley, University of Oxford, University of California Los Angeles, Harvard Business School","Hardware, Consumer Electronics, Real Estate, Internet Services","Newark, California, United States",4043,Series B,,12000000,-2.7,"Internet of Things, Consumer Electronics, Smart Home",01/01/2015,Operating,05/17/2017,12000000,0.5,12,0.898
956,Massdrop,96,"Massdrop, Zynga, Microsoft, Apple, Gap Inc.","University of California Berkeley, University of Toronto, San Francisco State University, Stanford University, University of California Davis","Commerce and Shopping, Internet Services","San Francisco, California, United States",4044,Series B,"$40,000,000",47850000,-0.5,"Internet, Shopping, E-Commerce",07/01/2012,Operating,08/13/2015,47850000,2.27,47.85,1.187
957,Nucleus,2063,"Nucleus Software, ICICI Bank, Tata Consultancy Services, HCL Technologies, HCL Infosystems Ltd.","Uttar Pradesh Technical University, Kendriya Vidyalaya, Delhi University, Guru Gobind Singh Indraprastha University, Indira Gandhi National Open University","Hardware, Consumer Electronics, Mobile","New York, New York, United States",4045,Series A,"$5,600,000",8970000,-1.2,"Electronics, Consumer Electronics, Wireless",01/01/2014,Operating,09/21/2016,8970000,1.16,8.97,0.889
958,Frame.io,36,"Gap Inc., SUNY Geneseo, Handy HQ, Saffron Digital, Deloitte","Princeton University, University of California Berkeley, Harvard University, University of North Carolina at Chapel Hill, Hunter College","Platforms, Media and Entertainment, Software, Video, Mobile","New York, New York, United States",4049,Series A,"$10,000,000",12200000,-0.9,"Media and Entertainment, iOS, Video",02/07/2014,Operating,09/14/2016,12200000,1.18,12.2,0.888
959,Gigster,192,"Gigster, Hewlett Packard Enterprise, Air Force Office of Special Investigations, IBM, Facebook","University of California Berkeley, Stanford University, UniversitÌ_t des Saarlandes, Cornell University, Hack Reactor","Apps, Software, Internet Services, Mobile","San Francisco, California, United States",4051,Series A,"$10,000,000",12500000,-1.5,"Internet, Mobile, Apps",01/01/2013,Operating,12/07/2015,12500000,1.95,12.5,1.199
960,Knowlarity Communications,576,"Knowlarity - Cloud Communications, IndiaMART InterMESH Limited, Reliance Communications, airtel, Serco - a world of experience","Delhi University, Kendriya Vidyalaya, Guru Gobind Singh Indraprastha University, Uttar Pradesh Technical University, Indira Gandhi National Open University","Hardware, Software, Internet Services","Gurgaon, Haryana, India",4060,Series C,"$20,000,000",42500000,0,"Telecommunications, Cloud Computing, SaaS, Emerging Markets, Small and Medium Businesses",08/17/2009,Operating,11/23/2016,42500000,0.98,42.5,0.893
961,BrandYourself,98,"BrandYourself, Franklin & Marshall College, MESH Experience, Her Campus Media, Victoria's Secret","Millersville University of Pennsylvania, Syracuse University, Franklin & Marshall College, Colgate University, Pennsylvania College of Art and Design","Information Technology, Sales and Marketing, Professional Services, Internet Services","New York, New York, United States",4067,Series A,"$2,000,000",7015000,-2.5,"Reputation, Search Engine, Brand Marketing, Employment",01/01/2009,Operating,08/04/2016,6800000,1.29,6.8,0.885
962,Pond5,226,"Pond5, Paddy Power Betfair, Pixmac s.r.o., American Express, Getty Images","Charles University in Prague, University of Economics, Prague, Czech University of Life Sciences Prague, Staffordshire University, Dublin Institute of Technology","Media and Entertainment, Music and Audio, Video, Content and Publishing","New York, New York, United States",4071,Series A,"$61,000,000",61500000,0.4,"Photography, Music, Video",01/01/2006,Operating,07/16/2014,61500000,3.34,61.5,0.721
963,SigOpt,11,"Facebook, DataSift, Princeton University, Bloomberg LP, BlackBerry","Universidad de Zaragoza, California Polytechnic State University-San Luis Obispo, Princeton University, Carleton University, University of Waterloo","Data and Analytics, Software, Artificial Intelligence","San Francisco, California, United States",4100,Series A,"$6,600,000",8720000,-1.1,"Machine Learning, Enterprise Software, SaaS",11/01/2014,Operating,08/24/2016,8720000,1.23,8.72,0.893
964,Soldo,43,"TIM, Real Fun Games, bwin, Lottomatica, Paymentsense","UniversitÌÊ degli Studi di Roma Tre, UniversitÌÊ Bocconi, Sapienza UniversitÌÊ di Roma, University of Rome Tor Vergata, Libera UniversitÌÊ di Lingue e Comunicazione IULM","Payments, Financial Services, Lending and Investments","London, England, United Kingdom",4102,Series A,"$11,000,000",22200000,-0.6,"Payments, FinTech, Banking, Financial Services, Small and Medium Businesses",01/01/2015,Operating,06/21/2017,22200000,0.41,22.2,0.898
967,Mia.com,4,"Bain & Company, University of DÌ_sseldorf, Magellan Biosciences Inc., Immucor Inc., Fenwal Inc., a Fresenius Kabi Company","University of DÌ_sseldorf, Harvard University, Tufts University, Brown University",Health Care,"Beijing, Beijing, China",40211,Series B,"¥30,000,000",5102426,0.8,"Health Care, Medical",01/01/2008,Operating,12/01/2011,5102426,5.97,5.102,0.878
970,TrueAccord,56,"TrueAccord, Square, Intuit, University of California, Berkeley, KPMG US","University of San Francisco, University of California Berkeley, San Francisco State University, Georgia Institute of Technology, University of Arizona","Administrative Services, Financial Services","San Francisco, California, United States",4133,Series Unknown,"$7,475,000",12725000,-0.8,"Debt Collections, Financial Services, FinTech",01/01/2013,Operating,12/16/2015,12725000,1.92,12.725,0.863
971,Peek,24,"MANGO, Paragon Wireless, Texas Instruments, Inditex, Zone Letting Ltd","Glasgow Caledonian University, North China University of Technology, Tsinghua University, Argosy University, Budapest Metropolitan University","Travel and Tourism, Commerce and Shopping, Internet Services, Mobile","San Francisco, California, United States",4146,Series A,"$10,000,000",16900000,-1.4,"E-Commerce, Travel, Mobile, Tourism, SaaS, Internet",01/01/2012,Operating,07/28/2016,16900000,1.31,16.9,0.885
972,ActionIQ,48,"IBM, Facebook, Applied Predictive Technologies, American Express, Google","University of Waterloo, University of California San Diego, University of Michigan, New York University, Carnegie Mellon University","Data and Analytics, Software, Sales and Marketing","New York, New York, United States",4155,Series A,"$13,000,000",15000000,-1.2,"Big Data, Enterprise Software, Analytics, Business Intelligence, Marketing Automation",07/01/2014,Operating,04/03/2017,15000000,0.62,15,1.16
973,Zugata,26,"VMware, Canaan Partners, Environmental Defense Fund, Cater2.me, Jive Software","San Jose State University, Stanford University, Carnegie Mellon University, University of Waterloo, Groep T - Internationale Hogeschool Leuven","Software, Mobile","Palo Alto, California, United States",4163,Series A,"$7,000,000",10200000,-0.5,"Software, Human Resources, Mobile",12/01/2014,Operating,11/14/2016,10200000,1.01,10.2,0.892
974,99.co,58,"Rumah.com, 99.co, iCar Asia Limited, HealthKart, Lazada Group","National University of Singapore, Nanyang Technological University, Singapore Management University, Universitas Terbuka, Nanyang Polytechnic","Real Estate, Internet Services, Financial Services","Singapore, Asia",4164,Series A,"$7,900,000",10060000,-1,"Internet, Real Estate Investment, Search Engine, Real Estate",01/08/2014,Operating,04/06/2017,10060000,0.62,10.06,0.897
975,Ascend.io,14,"Microsoft, IBM, Ooyala, Oracle, Extole","Stanford University, University of California Davis, Peking University, Tsinghua University, HEC Paris","Data and Analytics, Software","Palo Alto, California, United States",4165,Series A,"$15,000,000",19000000,-1.4,"Big Data, Software",10/01/2015,Operating,05/17/2017,19000000,0.5,19,1.348
976,PeopleDoc,100,"SAP SuccessFactors, Sears, Roebuck and Co., PeopleDoc Inc., SAP, IBM","HEC Paris, University of Paris I: PanthÌ©on-Sorbonne, PontifÌ_cia Universidade CatÌ_lica do Rio de Janeiro, UniversitÌ© de Bordeaux, Western University",,"New York, New York, United States",4172,Series C,"$28,000,000",47479335,-0.4,"Human Resources, SaaS, Innovation Management",01/01/2007,Operating,09/30/2015,47479335,2.13,47.479,0.855
