,company_name,num_employees,past_companies,past_schools,company_name_url,category_groups,headquarters_location,description,crunchbase_rank,website,last_funding_type,last_funding_amount,total_funding_amount,trend_score,categories,founded_date,last_funding_date,total_equity_funding_amount,valuation_at_ipo,time_since_last_funding,funding_ratio,score
812,Skymind,20.0,"Cloudera, Galvanize Inc, EPFL (École polytechnique fédérale de Lausanne), Fixstars Corporation（株式会社フィックスターズ）, collectAI","University of Pittsburgh, EPFL (École polytechnique fédérale de Lausanne), Udacity, Taurida 'V. I. Vernadskiy'​ National University, Simferopol, Columbia University in the City of New York",https://www.crunchbase.com/organization/skymind,"Science and Engineering, Information Technology, Data and Analytics, Software, Artificial Intelligence","San Francisco, California, United States","Skymind makes tools for prediction, data analytics and machine perception available to all businesses via open-core deep-learning.",3766,http://www.skymind.io,Seed,3000000,3320000,-1.8,"Artificial Intelligence, Business Intelligence, Analytics, Data Mining, Machine Learning, Big Data",01/01/2014,09/28/2016,3320000,,1.14,3.32,0.767
813,AISense Inc.,16.0,"Yahoo! Inc., Knowles Intelligent Audio, Google, Genesys | Interactive Intelligence, Robert Half","Stanford University, Nankai University, Peking University, Purdue University, Massachusetts Institute of Technology",https://www.crunchbase.com/organization/aisense-inc,"Information Technology, Software, Mobile","Los Altos, California, United States","AISense improves enterprise productivity with Ambient Voice Intelligence, a unique approach to speech recognition and deep learning.",3785,http://www.aisense.com,Series A,8200000,11200000,-0.8,"Information Technology, Mobile, Enterprise Software",02/01/2016,05/01/2017,11200000,,0.55,11.2,1.322
814,Superpedestrian,54.0,"TPI Composites Inc., Drexel Smart House, Amazon Robotics, Virginia Commonwealth University, Zipcar","Northeastern University, University of Massachusetts Lowell, Worcester Polytechnic Institute, Rensselaer Polytechnic Institute, University of Rhode Island",https://www.crunchbase.com/organization/superpedestrian,Transportation,"Cambridge, Massachusetts, United States",Superpedestrian is a venture-backed company developing lightweight electric vehicles with integrated online platforms.,3792,http://superpedestrian.com,Series B,21000000,25200000,-0.2,"Automotive, Autonomous Vehicles, Consumer",12/01/2012,06/01/2015,25200000,,2.47,25.2,0.801
815,BloomThat,38.0,"BloomThat, TBWA\Media Arts Lab, 1-800-FLOWERS.COM, INC., United States Postal Service, Eddie Bauer","University of the Sunshine Coast, San Francisco State University, University of California Santa Cruz, University of California Riverside, University of San Diego",https://www.crunchbase.com/organization/bloomthat,"Commerce and Shopping, Consumer Goods, Mobile","San Francisco, California, United States",Send a little something! Fresh Stems + Sweet Surprises. On-demand: SF | NYC | LA // Next Day: The entire U.S. of A!,3827,http://www.bloomthat.com,Series A,5500000,7600000,-1.1,"E-Commerce, Gift, Mobile, Flowers",06/01/2013,06/11/2015,7600000,,2.44,7.6,0.802
816,New Dada,38.0,"Anjuke Inc., Deutsche Bank, Goldensearches, Baidu Inc., IBM","Hohai University Wentian College, Anhui University, Anhui University of Finance and Economics, Chengdu University of Technology, Fudan University",https://www.crunchbase.com/organization/dada,"Apps, Software, Transportation, Internet Services, Mobile","Shanghai, Shanghai, China",New Dada is an Uber-like mobile app that provides last mile logistics services.,3831,http://imdada.cn,Funding Round,50000000,450000000,-0.3,"Mobile Apps, Mobile, Logistics, Internet",01/01/2014,10/20/2016,450000000,,1.08,450.0,0.874
817,Brighter.com,5.0,"Kablelink Communications, Domo Tactical Communications (DTC), United States Air Force, Hillsborough Community College, Vitera Healthcare Solutions","University of Tampa, Indiana State University, Hillsborough Community College",https://www.crunchbase.com/organization/brighter,"Commerce and Shopping, Health Care, Internet Services","Santa Monica, California, United States",Brighter creates an online marketplace that allows members to compare dentists by price and reputation.,3837,http://www.brighter.com,Series D,21000000,49000000,-0.1,"Marketplace, Internet, Dental",01/01/2011,04/20/2016,49000000,,1.58,49.0,1.033
818,Dropbox,2236.0,"Dropbox, Google, Microsoft, Oracle, Facebook","Stanford University, University of California Berkeley, Massachusetts Institute of Technology, The University of Texas at Austin, Carnegie Mellon University",https://www.crunchbase.com/organization/dropbox,"Hardware, Information Technology, Software, Internet Services","San Francisco, California, United States",Dropbox's mission is to provide a home for everyone's most important information and bring it to life.,3848,http://www.dropbox.com,Debt Financing,600000000,1707215000,-5.7,"Web Hosting, Enterprise Software, Collaboration, Private Cloud, File Sharing",06/01/2007,03/30/2017,607215000,,0.64,607.215,1.336
820,Rockets of Awesome,51.0,"J.Crew, Warby Parker, Macy's, Kohl's Department Stores, Gap Inc.","Fashion Institute of Technology, New York University, University of Cincinnati, Harvard Business School, Universidade do Porto",https://www.crunchbase.com/organization/rockets-of-awesome,"Hardware, Commerce and Shopping, Software","New York, New York, United States","Rockets of Awesome reinvents the way parents shop for kids by leveraging technology, data, brand, personalization, and merchandise.",3872,https://www.rocketsofawesome.com/,Series A,12500000,19500000,-0.9,"Retail Technology, Retail, Personalization, Children, E-Commerce",01/01/2016,01/03/2017,19500000,,0.87,19.5,0.868
821,POPSUGAR,598.0,"POPSUGAR, Condé Nast, Apple, Hearst Magazines, Viacom","New York University, University of Southern California, University of California Santa Barbara, University of Michigan, University of California Berkeley",https://www.crunchbase.com/organization/sugar,"Commerce and Shopping, Community and Lifestyle, Sports, Clothing and Apparel, Consumer Goods, Design","San Francisco, California, United States","PopSugar is an online network of websites that offers updates, trends, and tips in entertainment, fashion, parenting, fitness, and shopping.",3882,http://www.popsugar.com,Series Unknown,15000000,46000000,-3.0,"Fitness, Beauty, Fashion, Shopping, Lifestyle",04/01/2006,04/12/2011,46000000,,6.61,46.0,0.729
822,Aquantia,218.0,"Aquantia, Intel Corporation, Marvell Semiconductor, Centillium Communications, NXP Semiconductors","State University of Nizhni Novgorod named after N.I. Lobachevsky (UNN), Stanford University, Santa Clara University, University of Toronto, San Jose State University",https://www.crunchbase.com/organization/aquantia,"Science and Engineering, Hardware, Consumer Electronics, Mobile","Milpitas, California, United States",Aquantia is a semiconductor company developing Ethernet connectivity solutions for cloud computing and next generation enterprise networks,3888,http://www.aquantia.com,Series H,37000000,185624633,1.4,"Electronics, Semiconductor, Mobile",01/01/2004,04/10/2015,185624633,,2.61,185.625,0.798
823,Verge Genomics,15.0,"Stanford University, University of California, Los Angeles, Verge Genomics, Regeneron Pharmaceuticals Inc., University of California, Davis","University of California Los Angeles, Stanford University, Princeton University, University of Oregon, TU Dortmund University",https://www.crunchbase.com/organization/verge-genomics,"Biotechnology, Health Care","San Francisco, California, United States",Verge Genomics is looking to find cures for brain diseases.,3899,http://www.vergegenomics.com,Seed,4000000,4000000,0.7,"Genetics, Health Care",01/01/2015,10/29/2015,4000000,,2.05,4.0,0.821
825,Envoy,6.0,"Azure Production, Xerox, STAPLES Canada, marblemedia","Centennial College, Durham College",https://www.crunchbase.com/organization/envoy,"Software, Internet Services, Privacy and Security","San Francisco, California, United States",Envoy is the visitor registration product that is changing how visitors are greeted in workplaces around the world.,3914,https://envoy.com,Series Unknown,4162064,20312064,-1.0,"Security, Software, Cloud Storage, Human Resources",02/01/2013,05/04/2016,20312064,,1.54,20.312,1.128
826,Moglix,182.0,"Tata Steel, Snapdeal, Moglix, Tolexo Online Pvt. Ltd., AskmeBazaar","Uttar Pradesh Technical University, Asia Pacific Institute Of Management, Delhi University, Guru Gobind Singh Indraprastha University, Kendriya Vidyalaya",https://www.crunchbase.com/organization/moglix,"Commerce and Shopping, Mobile","Noida, Uttar Pradesh, India","Moglix is a supplier of industrial tools like hand tools, power tools, electrical, and safety equipment.",3916,http://www.moglix.com/,Series B,12000000,16205943,7.0,"Mobile, B2B, E-Commerce",01/01/2015,07/06/2017,16205943,,0.37,16.206,0.873
827,Druva,422.0,"Druva, Symantec, BMC Software, Dell EMC, Persistent Systems","University of Pune, San Jose State University, Pune Institute of Computer Technology, Indian Institute of Technology Bombay, Indian Institute of Technology Kanpur",https://www.crunchbase.com/organization/druva,"Hardware, Information Technology, Software, Professional Services, Internet Services","Sunnyvale, California, United States",Druva offers a cloud-first platform for data availability and information governance.,3917,http://www.druva.com,Series Unknown,80000000,198000000,5.0,"Cloud Data Services, Enterprise Software, Data Storage, Compliance",08/02/2008,08/22/2017,198000000,,0.24,198.0,0.878
828,LimeRoad,385.0,"Limeroad.com, FashionAndYou.com, ShopClues, Jabong, PolicyBazaar.com","Delhi University, National Institute of Fashion Technology, Netaji Subhas Institute of Technology, Kendriya Vidyalaya, Punjab Technical University",https://www.crunchbase.com/organization/limeroad,"Commerce and Shopping, Media and Entertainment, Clothing and Apparel, Internet Services, Design","Gurgaon, Haryana, India","LimeRoad is a social discovery platform enabling women to shop for apparel, shoes, bags, and more.",3927,http://www.limeroad.com,Series C,30000000,50000000,-0.9,"E-Commerce, Shopping, Internet, Social Media, Fashion",01/01/2012,03/30/2015,50000000,,2.64,50.0,0.793
829,Walker & Company Brands,32.0,"Citi, AOL, Walker & Company Brands Inc., Cisco, Target","San Jose State University, Stanford University Graduate School of Business, Harvard Business School, Cornell University, New York University",https://www.crunchbase.com/organization/walker-company-brands,"Commerce and Shopping, Health Care, Consumer Goods","Palo Alto, California, United States",We make health and beauty simple for people of color.,3930,http://walkerandcompany.com,Series B,24000000,33300000,-1.4,"Beauty, Health Care, Retail",04/18/2013,09/28/2015,33300000,,2.14,33.3,0.817
830,Tapingo,255.0,"Tapingo, Israel Defense Forces, Lonely Planet, eBay, Yelp","University of Arizona, University of Arkansas, California State University Chico, University of California Berkeley, Santa Clara University",https://www.crunchbase.com/organization/tapingo,"Apps, Commerce and Shopping, Software, Mobile","Tel Aviv, Tel Aviv, Israel",Tapingo is a mobile shopping platform.,3931,http://www.tapingo.com,Series C,22000000,36000000,-0.7,"Consumer, E-Commerce, Apps, Mobile",01/01/2012,04/02/2015,36000000,,2.63,36.0,0.793
831,Bellhops,495.0,"Bellhops, Covenant College, The University of Tennessee at Chattanooga, Groupon, Lowe's Companies Inc.","The University of Tennessee at Chattanooga, University of Tennessee, Knoxville, University of North Carolina at Charlotte, Virginia Commonwealth University, Covenant College",https://www.crunchbase.com/organization/bellhops,Professional Services,"Chattanooga, Tennessee, United States",We're The Future of Moving,3932,http://www.getbellhops.com,Debt Financing,6000000,27200000,-0.4,"Employment, Service Industry",01/01/2012,04/05/2017,21200000,,0.62,21.2,0.778
833,Crunchbase,74.0,"Salesforce, Crunchbase, Dropbox, LinkedIn, Google","University of California Berkeley, University of California Los Angeles, The University of Chicago, University of California Davis, University of Michigan",https://www.crunchbase.com/organization/crunchbase,"Data and Analytics, Community and Lifestyle, Financial Services, Lending and Investments","San Francisco, California, United States",Crunchbase allows users to discover innovative companies and the people behind them.,3936,https://www.crunchbase.com,Series B,18000000,26500000,-4.5,"Venture Capital, Analytics, Communities, Business Intelligence, FinTech, Big Data",07/01/2007,04/06/2017,26500000,,0.62,26.5,1.209
834,People.ai,32.0,"Responsys, Dell, Postindustria, Lexalytics Inc., Marketo","Télécom ParisTech, California State University Chico, University of California Berkeley Haas School of Business, Vanderbilt University, The University of Texas at Austin",https://www.crunchbase.com/organization/people-ai,"Science and Engineering, Data and Analytics, Software, Sales and Marketing, Artificial Intelligence","San Francisco, California, United States",People is a sales management platform that enables its users to manage their teams and grow revenues.,3939,https://people.ai/,Series A,7000000,7120000,-1.9,"Artificial Intelligence, Machine Learning, Predictive Analytics, Sales",01/01/2016,05/30/2017,7120000,,0.47,7.12,0.872
835,Fundera,65.0,"Fundera, Yelp, Irwin Union Bank, LivingSocial, Gilt.com","Columbia University in the City of New York, New York University, Amherst College, General Assembly, University of the Philippines",https://www.crunchbase.com/organization/fundera,"Internet Services, Financial Services","New York, New York, United States",Small Business Owner's Best Friend,3952,http://fundera.com,Series B,15500000,18900000,-0.3,"Internet, Lending, Financial Services",10/01/2013,09/17/2015,18900000,,2.17,18.9,1.078
837,Yottaa,64.0,"Endeca, PTC, Yottaa, Oracle, AG Salesworks","Boston University, University of Massachusetts Lowell, Beijing University of Posts and Telecommunications, Tianjin Polytechnic University, Tsinghua University",https://www.crunchbase.com/organization/yottaa,"Commerce and Shopping, Software, Internet Services, Content and Publishing","Waltham, Massachusetts, United States",Yottaa is an eCommerce Acceleration platform,3969,http://www.yottaa.com,Series Unknown,13000000,52445469,0.0,"Content Delivery Network, Enterprise Software, E-Commerce Platforms, Internet",04/01/2009,11/15/2016,52445469,,1.01,52.445,0.866
839,Solarflare Communications,190.0,"Solarflare Communications, Adaptec is now Microsemi, Entropic Communications, BT, Broadcom Limited","University of Cambridge, UC Irvine, California State University Fullerton, University of Oxford, San Diego State University",https://www.crunchbase.com/organization/solarflare,"Information Technology, Data and Analytics, Software, Privacy and Security","Irvine, California, United States",Solarflare Communications develops application-intelligent 10GbE server networking software and hardware solutions.,3974,http://www.solarflare.com,Series Unknown,22240273,304989098,2.0,"Enterprise Software, Big Data, Network Security",01/01/2001,11/30/2016,251971379,,0.96,251.971,0.872
841,Prism Skylabs,57.0,"Viewdle, Prism Skylabs, Motorola Mobility (a Lenovo Company), Cisco, CA Technologies","National Technical University of Ukraine 'Kyiv Polytechnic Institute'​, Kiev National Taras Shevchenko University, Occidental College, University of California Berkeley, Pontificia Universidad Católica del Perú",https://www.crunchbase.com/organization/prism-skylabs,"Science and Engineering, Hardware, Commerce and Shopping, Media and Entertainment, Data and Analytics, Software, Video, Privacy and Security, Artificial Intelligence","San Francisco, California, United States",Prism is a cloud-based video intelligence platform that transforms video cameras into powerful business tools.,3983,http://www.prism.com,Series B,15000000,23999700,-0.3,"Enterprise Software, Security, Retail, Business Intelligence, Artificial Intelligence, Analytics, Video, Computer Vision, Machine Learning",07/01/2011,10/22/2013,23999700,,4.07,24.0,0.749
842,Thanx,66.0,"Thanx, Oracle, Yelp, Groupon, Intuit","Dartmouth College, Universitat Autònoma de Barcelona, Colorado State University, University of Missouri-Columbia, University of Tasmania",https://www.crunchbase.com/organization/thanx,"Sales and Marketing, Mobile","San Francisco, California, United States",Effortless customer retention and loyalty.,3989,http://www.thanx.com,Series B,17100000,23100000,-0.8,"Loyalty Programs, Mobile",01/01/2012,12/08/2016,23100000,,0.94,23.1,0.867
843,SmartDrive Systems,333.0,"Qualcomm, SmartDrive Systems, ACTIVE Network, LLC, Comdata, Rand McNally","San Diego State University, University of California San Diego, Osmania University, The Ohio State University, Andhra University",https://www.crunchbase.com/organization/smartdrive-systems,"Information Technology, Data and Analytics, Government and Military","San Diego, California, United States",SmartDrive provides fuel management and driver safety solutions for customers in range of industries from waste management.,4001,http://smartdrive.net/,Series Unknown,50000000,180200887,0.0,"Information Technology, Analytics, Public Safety",01/01/2004,03/30/2015,180200887,,2.64,180.201,0.797
844,Mobcrush,26.0,"Microsoft, Twitter, Spatial View Inc., Machinima, Yahoo! Inc.","University of Southern California, University of Michigan, University of Mumbai, National University of Singapore, University of California Santa Barbara",https://www.crunchbase.com/organization/mobcrush-2,"Gaming, Platforms, Media and Entertainment, Software, Video, Content and Publishing, Mobile","Santa Monica, California, United States",Mobcrush is a live streaming app and community for mobile gamers.,4005,http://www.mobcrush.com/,Series B,20000000,35900000,-0.7,"Android, Gaming, Mobile, Video Streaming, iOS",01/01/2014,10/25/2016,35900000,,1.06,35.9,1.014
845,Riley,25.0,"DayMen Acquisition S.A., DayMen International Ltd, DayMen Group, McCann, Clarke & Associates","University of Guelph, Bournemouth University, Sheridan College",https://www.crunchbase.com/organization/riley-2,"Information Technology, Software, Sales and Marketing","San Francisco, California, United States",Riley offers lead qualification as a service.,4013,https://getrileynow.com/,Seed,3100000,3100000,-1.2,"Lead Management, Sales Automation, Information Services",03/01/2016,04/03/2017,3100000,,0.62,3.1,1.058
846,Innovium Inc,28.0,"Broadcom Limited, Cavium Inc, Intel Corporation, Sun Microsystems, Cisco","Indian Institute of Technology Delhi, Indian Institute of Technology Kanpur, Visvesvaraya Technological University, University of Southern California, Purdue University",https://www.crunchbase.com/organization/innovium-inc,"Hardware, Information Technology, Software, Design","San Jose, California, United States",Pre-launch infrastructure company,4017,http://www.innovium.com,Series C,38300000,88300000,-0.6,"Information Technology, Hardware, Product Design, Software",12/18/2014,03/14/2017,88300000,,0.68,88.3,0.872
847,Bonfire Studios,4.0,"DreamWorks Animation, Improving, Riot Games, Respawn Entertainment, Bank of America","University of Phoenix, School of the Art Institute of Chicago, The University of Texas at Austin",https://www.crunchbase.com/organization/bonfire-studios,Gaming,"Irvine, California, United States",Bonfire studios is an independent game studio in Orange County California.,4018,http://www.bonfirestudios.com/,Series Unknown,25000000,25000000,1.2,"Gamification, Online Games, Gaming",03/03/2016,09/12/2016,25000000,,1.18,25.0,1.048
848,Gigwalk,40.0,"Gameloft, Gigwalk, Apple, Microsoft, AT&T","Indian Institute of Technology Kharagpur, National Taiwan University, V. N. Karazin Kharkiv National University, Stanford University, University of Massachusetts Amherst",https://www.crunchbase.com/organization/gigwalk,"Commerce and Shopping, Navigation and Mapping, Data and Analytics, Internet Services, Mobile","San Francisco, California, United States",Gigwalk helps businesses manage channel execution at scale. Use of 1.2 Million Gigwalkers or Bring Your Own Team. All in one place,4023,http://www.gigwalk.com,Series B,10100000,17800000,-0.5,"Crowdsourcing, Location Based Services, Retail, Internet, Mobile",08/01/2010,03/20/2014,17800000,,3.67,17.8,0.758
849,Juicero,144.0,"Juicero, Fresh & Easy, Apple, The OutCast Agency, Odwalla","University of California Berkeley, University of California Davis, San Francisco State University, Stanford University, University of California San Diego",https://www.crunchbase.com/organization/juicero,"Food and Beverage, Health Care","San Francisco, California, United States",Juicero is the inventor of the first home cold-pressed juicing system.,4027,http://juicero.com/,Series C,28000000,118500000,-0.1,"Nutrition, Food and Beverage, Organic Food",01/01/2013,04/01/2016,118500000,,1.63,118.5,1.183
850,HYLA Mobile,127.0,"Sprint, Asurion, RadioShack, HYLA Mobile - Extending the Life Cycle of Mobile Devices, Smith Micro Software Inc.","University of North Texas, Naveen Jindal School of Management, UT Dallas, The University of Kansas, Anna University, Texas A&M University",https://www.crunchbase.com/organization/erecycling-corps,"Hardware, Consumer Electronics, Mobile","Farmers Branch, Texas, United States",HYLA Mobile' work will create economic opportunity for all who participate; help promote digital inclusion.,4034,http://www.hylamobile.com,Series C,105000000,140000000,1.7,"Mobile, Mobile Devices, Hardware",01/01/2009,10/28/2013,140000000,,4.06,140.0,0.659
852,Adknowledge,77.0,"Adknowledge, Sprint, DST Systems, Hallmark Cards, Fox Interactive Media","Kansas State University, The University of Kansas, Truman State University, University of Missouri-Kansas City, Pittsburg State University",https://www.crunchbase.com/organization/adknowledge,"Apps, Media and Entertainment, Software, Sales and Marketing, Internet Services, Video, Content and Publishing, Mobile, Advertising","Kansas City, Missouri, United States","Adknowledge is a digital advertising technology company, specializing in video, social, apps/mobile, email and content recommendation.",4038,http://adknowledge.com,Series B,200000000,262000000,-0.1,"Apps, Content Discovery, Mobile, Video, Advertising, Social Media",01/01/2004,01/12/2011,262000000,,6.85,262.0,0.734
854,Massdrop,96.0,"Massdrop, Zynga, Microsoft, Apple, Gap Inc.","University of California Berkeley, University of Toronto, San Francisco State University, Stanford University, University of California Davis",https://www.crunchbase.com/organization/massdrop,"Commerce and Shopping, Internet Services","San Francisco, California, United States",A social space and marketplace curated by you.,4044,http://massdrop.com,Series B,40000000,47850000,-0.5,"Internet, Shopping, E-Commerce",07/01/2012,08/13/2015,47850000,,2.27,47.85,1.149
855,Nucleus,2063.0,"Nucleus Software, ICICI Bank, Tata Consultancy Services, HCL Technologies, HCL Infosystems Ltd.","Uttar Pradesh Technical University, Kendriya Vidyalaya, Delhi University, Guru Gobind Singh Indraprastha University, Indira Gandhi National Open University",https://www.crunchbase.com/organization/nucleus,"Hardware, Consumer Electronics, Mobile","New York, New York, United States",Nucleus is a wireless home intercom system that can be activated with voice.,4045,http://www.nucleuslife.com,Series A,5600000,8970000,-1.2,"Electronics, Consumer Electronics, Wireless",01/01/2014,09/21/2016,8970000,,1.16,8.97,0.861
856,Frame.io,36.0,"Gap Inc., SUNY Geneseo, Handy HQ, Saffron Digital, Deloitte","Princeton University, University of California Berkeley, Harvard University, University of North Carolina at Chapel Hill, Hunter College",https://www.crunchbase.com/organization/frame-io,"Platforms, Media and Entertainment, Software, Video, Mobile","New York, New York, United States","Frame.io is an online platform that enables its users to privately upload, review, and share video with their teams.",4049,http://Frame.io,Series A,10000000,12200000,-0.9,"Media and Entertainment, iOS, Video",02/07/2014,09/14/2016,12200000,,1.18,12.2,0.86
857,Gigster,192.0,"Gigster, Hewlett Packard Enterprise, Air Force Office of Special Investigations, IBM, Facebook","University of California Berkeley, Stanford University, UniversitÌ_t des Saarlandes, Cornell University, Hack Reactor",https://www.crunchbase.com/organization/gigster,"Apps, Software, Internet Services, Mobile","San Francisco, California, United States","Gigster provides software development and access to elite teams of developers, designers, and product managers.",4051,https://gigster.com/,Series A,10000000,12500000,-1.5,"Internet, Mobile, Apps",01/01/2013,12/07/2015,12500000,,1.95,12.5,1.164
858,Knowlarity Communications,576.0,"Knowlarity - Cloud Communications, IndiaMART InterMESH Limited, Reliance Communications, airtel, Serco - a world of experience","Delhi University, Kendriya Vidyalaya, Guru Gobind Singh Indraprastha University, Uttar Pradesh Technical University, Indira Gandhi National Open University",https://www.crunchbase.com/organization/knowlarity-communications,"Hardware, Software, Internet Services","Gurgaon, Haryana, India",Knowlarity Communications is a cloud telephony company in Asia,4060,http://knowlarity.com,Series C,20000000,42500000,0.0,"Telecommunications, Cloud Computing, SaaS, Emerging Markets, Small and Medium Businesses",08/17/2009,11/23/2016,42500000,,0.98,42.5,0.866
