,company_name,num_employees,past_companies,past_schools,company_name_url,category_groups,headquarters_location,description,crunchbase_rank,website,last_funding_type,last_funding_amount,total_funding_amount,trend_score,categories,founded_date,last_funding_date,total_equity_funding_amount,valuation_at_ipo,time_since_last_funding,funding_ratio,score
0,Affirm,281.0,"Google, Affirm Inc., LinkedIn, Stanford University, Capital One","Stanford University, University of California Berkeley, Carnegie Mellon University, University of California Los Angeles, The Wharton School",https://www.crunchbase.com/organization/affirm,"Payments, Financial Services, Lending and Investments","San Francisco, California, United States","Affirm, a financial technology services company, offers installment loans to consumers at the point of sale.",15903,https://affirm.com,Debt Financing,100000000,520000000,-1.7,"Consumer Lending, FinTech, Financial Services, Payments",01/01/2012,10/13/2016,420000000,,1.1,420.0,1.323
2,Flexport,464.0,"Flexport, Kuehne + Nagel, Damco, EY, Deloitte","University of California Berkeley, Stanford University, University of California Los Angeles, University of Southern California, University of California Davis",https://www.crunchbase.com/organization/flexport,Transportation,"San Francisco, California, United States","Flexport is a platform for global trade. The company makes it easy for businesses to move products by air, land, and sea around the world.",26670,https://www.flexport.com/,Series C,110000000,204000000,-2.9,"Supply Chain Management, Shipping, Logistics",03/01/2013,9/21/2017,204000000,,0.16,204.0,1.215
3,Qadium,67.0,"Stanford University, University of Washington, Apex Systems, Palantir Technologies, Palo Alto Networks","Stanford University, Caltech, University of California Berkeley, University of Pennsylvania, University of Cambridge",https://www.crunchbase.com/organization/qadium-solutions,"Information Technology, Software, Privacy and Security","San Francisco, California, United States",Qadium creates and organizes knowledge about the world's devices.,4492,https://qadium.com/,Series B,40000000,65970000,-0.7,"Software, Security, Information Technology, Cyber Security",05/01/2012,8/30/2017,65970000,,0.22,65.97,1.324
4,Blend,260.0,"Blend, Palantir Technologies, Salesforce, Pandora, Clarium Capital Management","Stanford University, University of California Berkeley, University of California Davis, Carnegie Mellon University, San Francisco State University",https://www.crunchbase.com/organization/blend-labs,"Real Estate, Financial Services","San Francisco, California, United States","Blend's technology empowers top mortgage lenders to be more efficient, compliant, and borrower-friendly.",179,https://www.blend.com,Series D,100000000,160000000,8.3,"FinTech, Financial Services, Home Services, Enterprise",05/01/2012,08/24/2017,160000000,,0.23,160.0,1.327
8,Cadre,87.0,"Morgan Stanley, Goldman Sachs, Google, Square, The Blackstone Group","University of Pennsylvania, Harvard University, The Wharton School, Vanderbilt University, Georgetown University",https://www.crunchbase.com/organization/cadre-2,"Commerce and Shopping, Real Estate, Financial Services","New York, New York, United States",Cadre is an online marketplace that connects investors and operators of real estate.,1235,http://cadre.com,Series C,65000000,133300000,-2.9,"FinTech, Financial Services, Real Estate, Marketplace",09/11/2014,06/06/2017,133300000,,0.45,133.3,1.1
10,Zocdoc,587.0,"Zocdoc, Apple, Microsoft, Yodle, Arizona State University","Arizona State University, Cornell University, New York University, Columbia University in the City of New York, Stony Brook University",https://www.crunchbase.com/organization/zocdoc,"Commerce and Shopping, Health Care","New York, New York, United States",Zocdoc is the beginning of a better healthcare experience for millions of patients every month.,960,http://www.zocdoc.com,Series D,130000000,223000000,-0.9,"Dental, Health Care, Marketplace, Medical",09/18/2007,08/20/2015,223000000,,2.25,223.0,0.817
11,SpaceX,4602.0,"SpaceX, Boeing, US Navy, United States Air Force, GE Aviation","University of Southern California, Embry-Riddle Aeronautical University, University of California Los Angeles, Stanford University, Massachusetts Institute of Technology",https://www.crunchbase.com/organization/space-exploration-technologies,"Science and Engineering, Transportation","Hawthorne, California, United States","SpaceX designs, manufactures, and launches advanced rockets and spacecraft.",6,http://www.spacex.com,Private Equity,350000000,1495560000,0.8,"Space Travel, Aerospace, Transportation",06/01/2002,07/27/2017,1495560000,,0.31,1495.56,1.06
12,BuzzFeed,2020.0,"BuzzFeed, NBCUniversal Media, LLC, Viacom, Yahoo! Inc., The New York Times","New York University, Syracuse University, University of Southern California, Columbia University - Graduate School of Journalism, University of California Los Angeles",https://www.crunchbase.com/organization/buzzfeed,"Media and Entertainment, Internet Services, Video, Content and Publishing","New York, New York, United States","BuzzFeed provides shareable breaking news, original reporting, entertainment, and videos across the social web.",11,http://www.buzzfeed.com,Series G,200000000,496300000,-0.1,"Internet, News, Video, Digital Entertainment, Social",01/01/2006,11/18/2016,496300000,,1.0,496.3,0.877
15,DJI,816.0,"DJI, Sony, Samsung Electronics, Microsoft, Crossbow Technology, Inc","The Hong Kong University of Science and Technology, University of California Berkeley, Sun Yat-Sen University, Wuhan University, UC Irvine",https://www.crunchbase.com/organization/dji,"Manufacturing, Science and Engineering, Hardware, Consumer Electronics, Mobile","Shenzhen, Guangdong, China",DJI Innovations is a Chinese company that produces commercial and recreational unmanned aerial systems.,20,http://www.dji.com/,Series B,75000000,105000000,3.2,"Manufacturing, Wireless, Consumer Electronics, Aerospace",11/06/2006,05/05/2015,105000000,,2.54,105.0,0.799
19,Flipkart,13806.0,"Flipkart, Amazon, Yahoo! Inc., Infosys, Tata Consultancy Services","Kendriya Vidyalaya, Delhi University, Bangalore University, Birla Institute of Technology and Science, Pilani, University of Mumbai",https://www.crunchbase.com/organization/flipkart,"Commerce and Shopping, Community and Lifestyle, Clothing and Apparel, Design","Bangalore, Karnataka, India","Flipkart is an online shopping destination for electronics, books, music, and movies in India.",28,http://www.flipkart.com,Secondary Market,1000000000,7122140000,-2.9,"E-Commerce, Shopping, Fashion, Retail, Lifestyle",09/01/2007,08/10/2017,7122140000,,0.27,7122.14,0.959
21,WeWork,2463.0,"WeWork, Apple, Abercrombie & Fitch, Starwood Hotels & Resorts Worldwide Inc., American Express","New York University, Cornell University, Syracuse University, General Assembly, Penn State University",https://www.crunchbase.com/organization/wework,"Travel and Tourism, Real Estate","New York, New York, United States","WeWork is a platform for creators that transforms buildings into dynamic environments for creativity, focus, and collaboration.",32,https://www.wework.com,Private Equity,4400000000,9853784331,4.8,"Hospitality, Property Development, Building Maintenance",01/01/2017,08/25/2017,9853784331,,0.23,9853.784,1.123
22,Databricks,223.0,"Microsoft, Google, Databricks, IBM, Axway","University of California Berkeley, Stanford University, University of Southern California, Peking University, Princeton University",https://www.crunchbase.com/organization/databricks,"Data and Analytics, Software","San Francisco, California, United States","Databricks accelerates innovation by unifying analytics across data science, data engineering, and the business.",35,https://databricks.com,Series D,140000000,247000000,8.5,"Analytics, Enterprise Software, Open Source",01/01/2013,08/22/2017,247000000,,0.24,247.0,1.216
23,ThoughtSpot,220.0,"IBM, ThoughtSpot, Oracle, Google, Stanford University","Stanford University, San Jose State University, University of California Berkeley, Indian Institute of Technology Guwahati, Indian Institute of Technology Kanpur",https://www.crunchbase.com/organization/thoughtspot,"Data and Analytics, Software","Palo Alto, California, United States",Search-driven Analytics for the Enterprise. New breed of Relational Search Engine designed for data analytics.,36,http://thoughtspot.com,Series C,60000000,150700000,9.5,"Business Intelligence, Enterprise Software, Big Data, Analytics",06/01/2012,08/17/2017,150700000,,0.25,150.7,1.326
24,Hyperloop One,312.0,"Hyperloop One, SpaceX, Cisco, Northrop Grumman, RBC Bearings","University of Southern California, Stanford University, UC Irvine, California State University Northridge, California State Polytechnic University-Pomona",https://www.crunchbase.com/organization/hyperloop-technolgies,"Manufacturing, Travel and Tourism, Transportation","Los Angeles, California, United States",Hyperloop One reinvents transportation to eliminate barriers of time.,38,https://hyperloop-one.com/,Convertible Note,50000000,141100000,4.6,"Manufacturing, Transportation, Travel",01/01/2014,10/13/2016,141100000,,1.1,141.1,1.016
26,Impossible Foods,192.0,"Impossible Foods, University of California, Davis, University of California, Santa Barbara, Target, Codexis Inc.","University of California Berkeley, University of California Davis, San Jose State University, Stanford University Graduate School of Business, University of California Santa Barbara",https://www.crunchbase.com/organization/impossible-foods,"Food and Beverage, Health Care","Redwood City, California, United States",Impossible Foods develops a new generation of meats and cheeses made entirely from plants.,44,http://impossiblefoods.com/,Convertible Note,75000000,273500000,8.6,"Food and Beverage, Food Processing, Nutrition",01/01/2011,08/01/2017,257000000,,0.3,257.0,1.217
27,Lyft,8321.0,"Lyft, Google, US Army, US Navy, Walmart","University of Phoenix, University of California Berkeley, San Francisco State University, Stanford University, Arizona State University",https://www.crunchbase.com/organization/lyft,"Apps, Software, Transportation, Mobile","San Francisco, California, United States",Lyft is reconnecting people and communities through better transportation.,45,http://lyft.com,Series G,600000000,2612500000,5.4,"Transportation, Ride Sharing, Mobile Apps, Peer to Peer",01/01/2007,04/11/2017,2612500000,,0.6,2612.5,0.937
28,Outbrain,640.0,"Outbrain, Microsoft, Israel Defense Forces, Yahoo! Inc., IDF","Tel Aviv University, Technion - Israel Institute of Technology, Ben-Gurion University of the Negev, IDC Herzliya, The Hebrew University of Jerusalem",https://www.crunchbase.com/organization/outbrain,"Media and Entertainment, Sales and Marketing, Internet Services, Content and Publishing","New York, New York, United States",Outbrain is a content discovery platform providing publishers a service for recommended links to increase traffic and generate revenue.,47,http://www.outbrain.com,Private Equity,45000000,194000000,5.5,"Internet, Content Discovery, Digital Marketing, Content Marketing",01/01/2006,05/10/2016,194000000,,1.52,194.0,0.852
29,TuneIn,232.0,"TuneIn, iHeartMedia, Sirius XM Radio Inc., CBS Interactive, Morgan Stanley","San Francisco State University, University of California Berkeley, University of Southern California, Stanford University, Massachusetts Institute of Technology",https://www.crunchbase.com/organization/tunein-inc,"Media and Entertainment, Music and Audio, Content and Publishing, Mobile","San Francisco, California, United States","TuneIn allows users to stream and listen to online radio, talkshows, and news on demand.",48,http://tunein.com,Series Unknown,50000000,103122231,6.9,"Mobile, Music, Internet Radio, News",01/01/2002,08/11/2017,103122231,,0.27,103.122,0.875
32,Razer,695.0,"Razer Inc., Microsoft, Dell, Apple, Nextbit Systems","National University of Singapore, Nanyang Technological University, Singapore Polytechnic, Temasek Polytechnic, California State University Fullerton",https://www.crunchbase.com/organization/razer,"Gaming, Platforms, Hardware, Consumer Electronics, Software, Mobile","Irvine, California, United States","Razer develops high-end precision gaming products by combining technology, ergonomics, and expert validation.",54,http://www.razerzone.com,Funding Round,50000000,175000000,-1.9,"Gaming, iOS, Consumer Electronics",06/27/2005,05/15/2017,175000000,,0.51,175.0,0.876
33,Coinbase,183.0,"Coinbase, Bain & Company, Google, Guidewire Software, Facebook","University of California Berkeley, Duke University, UC Irvine, Colorado State University, Santa Clara University",https://www.crunchbase.com/organization/coinbase,"Commerce and Shopping, Software, Payments, Financial Services","San Francisco, California, United States",Coinbase is a digital currency wallet service that allows traders to buy and sell bitcoin.,58,https://www.coinbase.com,Series D,100000000,217209590,-2.4,"E-Commerce, Personal Finance, FinTech, Cryptocurrency, Bitcoin",06/01/2012,08/10/2017,217209590,,0.27,217.21,1.216
35,Warby Parker,775.0,"Warby Parker, Anthropologie, Apple, Urban Outfitters, Lenscrafters","Fashion Institute of Technology, Belmont University, New York University, Baruch College, The Wharton School",https://www.crunchbase.com/organization/warby-parker,"Commerce and Shopping, Clothing and Apparel, Design","New York, New York, United States","BUY A PAIR, GIVE A PAIR For every pair of glasses purchased, WP provides a pair to someone in need.",71,http://www.warbyparker.com,Series D,100000000,215500000,-0.2,"E-Commerce, Retail, Fashion",01/01/2010,04/30/2015,215000000,,2.55,215.0,0.802
38,Klarna,1270.0,"Klarna, Ericsson, American Express, SEB, Nordnet Bank AB","Stockholm University, KTH Royal Institute of Technology, Uppsala University, Linköping University, Lund University",https://www.crunchbase.com/organization/klarna,"Commerce and Shopping, Payments, Financial Services","Stockholm, Stockholms Lan, Sweden",Klarna provides e-commerce payment solutions for merchants and shoppers.,80,http://www.klarna.com,Private Equity,225000000,636846585,-2.1,"Payments, FinTech, Financial Services, E-Commerce",02/01/2005,07/21/2017,601443112,,0.33,601.443,0.888
40,Duolingo,224.0,"Carnegie Mellon University, Duolingo, Google, Microsoft, University of Pittsburgh","Carnegie Mellon University, University of Pittsburgh, Massachusetts Institute of Technology, Concordia University, Universidad del Valle de Guatemala",https://www.crunchbase.com/organization/duolingo,"Software, Education, Internet Services","Pittsburgh, Pennsylvania, United States",Duolingo is a free language education platform that gamifies every lessons available in over 20 languages.,83,https://www.duolingo.com,Series E,25000000,108300000,3.1,"E-Learning, Education, Internet, Language Learning",01/01/2011,07/25/2017,108300000,,0.32,108.3,1.138
42,AppNexus,1008.0,"AppNexus, 24/7 Media Inc., Microsoft, Xaxis, IBM","Columbia University in the City of New York, New York University, Princeton University, Brown University, Cornell University",https://www.crunchbase.com/organization/appnexus,"Sales and Marketing, Internet Services, Advertising","New York, New York, United States",AppNexus is a technology company whose cloud-based software platform enables and optimizes programmatic online advertising.,88,http://www.appnexus.com,Funding Round,31000000,321471856,-0.2,"Advertising, Internet, Service Industry",09/01/2007,09/28/2016,321471856,,1.14,321.472,1.132
44,Coursera,930.0,"Coursera, Google, Microsoft, Stanford University, LinkedIn","Stanford University, University of California Berkeley, Coursera, The Johns Hopkins University, University of Washington",https://www.crunchbase.com/organization/coursera,"Software, Education, Internet Services","Mountain View, California, United States",Coursera is scaling a global platform to provide universal access to the world’s best education.,99,http://www.coursera.org,Series D,64000000,210100000,-2.2,"Enterprise, EdTech, Education, Internet",01/01/2012,06/07/2017,210100000,,0.45,210.1,1.327
48,Color Genomics,123.0,"Twitter, Google, University of California, Davis, Genomic Health, Genoptix Inc.","Stanford University, University of California Berkeley, Massachusetts Institute of Technology, University of California Davis, University of California Los Angeles",https://www.crunchbase.com/organization/color-genomics,"Biotechnology, Science and Engineering, Data and Analytics, Software, Health Care, Artificial Intelligence, Design","Burlingame, California, United States",Color Genomics provides a service that helps people proactively manage their health through affordable and clinical-grade genetic data.,112,https://www.color.com,Series C,52000000,150548112,8.6,"Machine Learning, Product Design, Biotechnology, Genetics",01/01/2013,08/16/2017,150548112,,0.25,150.548,1.326
50,Cylance,783.0,"McAfee, Cylance Inc., Symantec, Intel Corporation, FireEye Inc.","UC Irvine, California State University Fullerton, University of California Los Angeles, The University of Texas at Austin, California State University-Long Beach",https://www.crunchbase.com/organization/cylance,"Science and Engineering, Hardware, Information Technology, Consumer Electronics, Data and Analytics, Software, Privacy and Security, Artificial Intelligence","Irvine, California, United States",Cylance is a global provider of cybersecurity products and services to solve the world's most difficult security problems.,116,http://www.cylance.com,Series D,100000000,177000000,-0.2,"Artificial Intelligence, Computer, Cyber Security, Machine Learning",07/04/2012,06/08/2016,177000000,,1.44,177.0,0.855
51,Glassdoor,894.0,"Glassdoor, CareerBuilder, Groupon, Ask.com, Microsoft","University of California Berkeley, San Francisco State University, Purdue University, University of Illinois at Urbana-Champaign, Santa Rosa Junior College",https://www.crunchbase.com/organization/glassdoor,"Media and Entertainment, Professional Services, Internet Services","Mill Valley, California, United States",Glassdoor is a jobs and recruiting marketplace that is changing how people search for jobs and how companies recruit top talent.,120,http://glassdoor.com,Series H,40000000,204500000,-2.3,"Recruiting, Social Media, Career Planning, Employment",06/01/2007,06/03/2016,204500000,,1.46,204.5,1.192
52,Funding Circle,225.0,"Funding Circle US, LendingClub, Funding Circle UK, J.P. Morgan, American Express","University of California Berkeley, San Francisco State University, University of California Davis, University of California Santa Barbara, University of San Francisco",https://www.crunchbase.com/organization/funding-circle,Financial Services,"London, England, United Kingdom","Funding Circle is a lending platform focused exclusively on small businesses operating in in the U.S., the U.K. and Continental Europe.",122,http://www.fundingcircle.com,Series F,100000000,413237070,-2.2,"FinTech, Personal Finance, Financial Services, Finance",08/13/2010,01/11/2017,373237070,,0.85,373.237,1.215
53,Evernote,450.0,"Evernote, Apple, Google, Yahoo! Inc., Microsoft","University of California Berkeley, Stanford University, The University of Texas at Austin, University of California Los Angeles, San Jose State University",https://www.crunchbase.com/organization/evernote,"Platforms, Information Technology, Software, Mobile","Redwood City, California, United States","Evernote is a suite of software and services that allow users to capture, organize, and find information across multiple platforms.",129,http://www.evernote.com,Series E,20000000,290000000,-0.7,"iOS, Mobile, Information Technology, Information Services",02/29/2000,11/09/2014,290000000,,3.02,290.0,1.121
56,Ola,235.0,"Made Foods Inc, Jindal Intellicom Limited, Gilbane Building Company, P G Patki Architects, GSC Architects","The University of Lethbridge, Bangalore University, University of Mumbai, Uttar Pradesh Technical University, University of Arizona",https://www.crunchbase.com/organization/ani-technologies,"Apps, Commerce and Shopping, Software, Transportation, Internet Services, Mobile","Bengaluru, Karnataka, India",Ola is a mobile app for cab booking in India.,145,http://www.olacabs.com,Private Equity,36000000,1752942518,-5.5,"Ride Sharing, Transportation, Mobile, Internet, E-Commerce, Apps",12/03/2010,08/11/2017,1752942518,,0.27,1752.943,0.917
57,Eventbrite,657.0,"Eventbrite, ticketscript by Eventbrite, Dell, Ticketmaster, Belatrix Software","Middle Tennessee State University (MTSU), University of California Berkeley, University of San Francisco, Belmont University, Universidad Tecnológica Nacional",https://www.crunchbase.com/organization/eventbrite,"Media and Entertainment, Events, Internet Services","San Francisco, California, United States",Eventbrite is the world’s largest event technology platform which powers more than two million events around the globe each year.,146,http://www.eventbrite.com,Private Equity,60000000,198275000,-1.2,"Events, Internet, Ticketing, Event Management",01/01/2006,03/13/2014,196775000,,3.68,196.775,0.762
58,SoundCloud,800.0,"SoundCloud, Sony Music Entertainment, Google, BBC, Warner Music Group","University of California Berkeley, Technische Universität Berlin, New York University, Freie Universität Berlin, Stanford University",https://www.crunchbase.com/organization/soundcloud,"Apps, Media and Entertainment, Music and Audio, Software","Berlin, Germany, Europe",SoundCloud is a social sound platform where anyone can create and share sounds.,148,http://www.soundcloud.com/,Series F,169500000,467819000,4.2,"Music, Independent Music, Apps",01/01/2007,08/11/2017,362819000,,0.27,362.819,1.219
62,Big Switch Networks,155.0,"Cisco, Juniper Networks, Gigamon, Brocade, VMware","Stanford University, San Jose State University, University of Mumbai, San Francisco State University, Wichita State University",https://www.crunchbase.com/organization/big-switch-networks,"Hardware, Information Technology, Software, Privacy and Security","Santa Clara, California, United States","Big Switch Networks is the Next-Generation Data Center Networking Company, designing intelligent, agile and flexible networks",163,http://www.bigswitch.com,Funding Round,30700000,119500000,6.9,"Data Center, Network Security, Software",01/01/2010,07/27/2017,119500000,,0.31,119.5,1.326
63,App Annie,584.0,"App Annie, Google, GfK, IBM, Mobidia","University of California Berkeley, San Francisco State University, Stanford University, The Wharton School, San Jose State University",https://www.crunchbase.com/organization/app-annie,"Data and Analytics, Mobile","San Francisco, California, United States",App Annie delivers data and insights to succeed in the app economy.,166,http://www.appannie.com,Series E,63000000,156000000,-2.0,"Mobile, Big Data, Analytics",03/01/2010,01/13/2016,156000000,,1.85,156.0,1.173
65,ClassPass,248.0,"ClassPass, Viacom, Bain & Company, Yelp, Sony Online Entertainment","New York University, University of California Berkeley, Brown University, Harvard University, Columbia University in the City of New York",https://www.crunchbase.com/organization/classpass,"Apps, Software, Sports, Health Care","New York, New York, United States",ClassPass is the leading membership to the world’s largest fitness network.,174,http://classpass.com,Series C,70000000,154000000,-1.6,"Fitness, Consumer Applications, Health Care, Subscription Service",01/01/2013,06/16/2017,154000000,,0.42,154.0,0.876
66,Vets First Choice,221.0,"Vets First Choice, IDEXX, L.L.Bean, Nationwide Payments, Unum","University of Southern Maine, University of Maine, Kansas State University, Northeastern University, University of New England",https://www.crunchbase.com/organization/vets-first-choice,"Commerce and Shopping, Health Care","Portland, Maine, United States",Vets First Choice provides veterinary practices with an online pharmacy and home delivery services.,178,http://www.vetsfirstchoice.com/,Funding Round,223000000,285800000,9.1,"E-Commerce, Pharmaceutical, Veterinary",01/01/2010,07/19/2017,285800000,,0.33,285.8,0.88
68,Rent the Runway,466.0,"Rent The Runway, Macy's, Bloomingdale's, SoulCycle Inc., Lord & Taylor","New York University, Montclair State University, Columbia University in the City of New York, Fashion Institute of Technology, University of Pennsylvania",https://www.crunchbase.com/organization/rent-the-runway,"Commerce and Shopping, Clothing and Apparel, Design","New York, New York, United States",Rent the Runway is an online e-commerce website that allows women to rent designer apparel and accessories.,183,http://www.renttherunway.com,Series E,60000000,176150000,4.4,"Fashion, E-Commerce, Retail",11/09/2009,12/27/2016,176150000,,0.89,176.15,0.872
69,Airbnb,6213.0,"Airbnb, Google, Facebook, Microsoft, Apple","University of California Berkeley, Stanford University, Carnegie Mellon University, San Francisco State University, University of California Los Angeles",https://www.crunchbase.com/organization/airbnb,"Travel and Tourism, Commerce and Shopping","San Francisco, California, United States","Airbnb is an online community marketplace for people to list, discover, and book accommodations around the world.",188,http://airbnb.com,Series F,447800000,4398082100,-2.7,"Hospitality, Sharing Economy, Marketplace, Travel Accommodations, Travel",08/11/2008,03/09/2017,3398082100,,0.69,3398.082,1.294
