,company_name,num_employees,past_companies,past_schools,company_name_url,category_groups,headquarters_location,description,crunchbase_rank,website,last_funding_type,last_funding_amount,total_funding_amount,trend_score,categories,founded_date,last_funding_date,total_equity_funding_amount,valuation_at_ipo,time_since_last_funding,funding_ratio,score
419,Kensho,116.0,"Kensho, Harvard University, Google, Morgan Stanley, Deloitte","Harvard University, Princeton University, Massachusetts Institute of Technology, Columbia University in the City of New York, University of Oxford",https://www.crunchbase.com/organization/kensho,"Information Technology, Data and Analytics, Software, Internet Services, Artificial Intelligence","Cambridge, Massachusetts, United States","Kensho combines natural language search, graphical user interfaces, and secure cloud computing to create a new class of analytics tools",1659,https://www.kensho.com,Series B,50000000,67495000,-1.3,"Software, Cloud Data Services, Machine Learning, Analytics",05/01/2013,02/28/2017,67000000,,0.72,67.0,1.171
420,BaubleBar,90.0,"BaubleBar Inc., Bloomingdale's, Gilt.com, Macy's, Citi","Savannah College of Art and Design, CUNY New York City College of Technology, Harvard Business School, New Jersey Institute of Technology, Fashion Institute of Technology",https://www.crunchbase.com/organization/baublebar,"Commerce and Shopping, Clothing and Apparel, Consumer Goods, Design","New York, New York, United States","BaubleBar is a one-stop retailer for affordable, on-trend fashion jewelry.",1661,http://baublebar.com,Debt Financing,13000000,48600000,1.9,"Jewelry, Fashion, E-Commerce",01/01/2010,03/29/2017,35600000,,0.64,35.6,0.872
422,LeadGenius,453.0,"LeadGenius, University of California, Berkeley, Stream Global Services, MobileWorks, Oracle","University of Belgrade, University of California Berkeley, University of Nairobi, The University of the West Indies, Mona, INTI International University & Colleges",https://www.crunchbase.com/organization/mobileworks,"Information Technology, Data and Analytics, Software, Sales and Marketing, Professional Services","Berkeley, California, United States","LeadGenius is an end-to-end sales solution that provides companies with a way to generate, qualify, deliver, and convert leads.",1664,https://leadgenius.com,Series B,4000000,20000000,1.6,"Enterprise Software, Lead Generation, Big Data, Sales Automation, Outsourcing, Crowdsourcing",01/01/2011,12/05/2016,20000000,,0.95,20.0,0.773
424,Alfresco,456.0,"Alfresco, IBM, Dell EMC, Oracle, OpenText","University of Bath, University of California Santa Barbara, Santa Clara University, Georgia Institute of Technology, Southern Polytechnic State University",https://www.crunchbase.com/organization/alfresco,"Information Technology, Software","San Mateo, California, United States",Alfresco is an enterprise open-source software company automating content centric processes for digital business,1666,http://www.alfresco.com,Series D,45000000,68500000,-0.6,"Collaboration, Enterprise Software, Enterprise, Document Management",01/01/2005,08/21/2014,68500000,,3.24,68.5,0.771
425,GoEuro,251.0,"GoEuro, eBay, ImmobilienScout24, ResearchGate, Microsoft","Freie Universität Berlin, Cairo University, University of Leeds, Università Bocconi, Hanzehogeschool Groningen / Hanze University of Applied Sciences Groningen",https://www.crunchbase.com/organization/goeuro,"Travel and Tourism, Internet Services","Berlin, Berlin, Germany","GoEuro is a multi-mode search tool that compares and combines rail, air, bus, and car for European destinations.",1670,http://www.GoEuro.com,Series C,70000000,146000000,-1.3,"Search Engine, Business Development, Travel, Internet",03/01/2012,10/03/2016,146000000,,1.12,146.0,0.865
426,Pivot3,241.0,"Hewlett Packard Enterprise, Dell, SanDisk®, NexGen Storage, Cisco","The University of Texas at Austin, Texas State University, Wichita State University, University of Phoenix, University of Colorado Denver",https://www.crunchbase.com/organization/pivot3,"Hardware, Media and Entertainment, Information Technology, Software, Video","Austin, Texas, United States",Pivot3 is the world’s leading provider of dynamic hyperconverged solutions.,1673,http://www.pivot3.com,Series H,55000000,253437500,-0.3,"Video, Software, Data Storage, Virtual Desktop, Data Center",01/01/2003,03/15/2016,253437500,,1.68,253.438,0.996
427,PicsArt,324.0,"PicsArt Inc., Sourcio, be2, Monitis, BetConstruct","Yerevan State University, State Engineering University of Armenia, American University of Armenia, Russian - Armenian University, Armenian State University of Economics",https://www.crunchbase.com/organization/picsart,"Apps, Media and Entertainment, Software, Internet Services, Content and Publishing, Mobile","San Francisco, California, United States",PicsArt is a leading image editing app and creative community.,1675,http://picsart.com/,Series B,20000000,45000000,-1.2,"Mobile, Photo Editing, Apps, Social Media, Photography",01/01/2012,04/20/2016,45000000,,1.58,45.0,0.846
428,Honor,218.0,"Google, Meebo, Apple, Home Instead Senior Care, Culver-Stockton College","Stanford University, Stanford University Graduate School of Business, General Assembly, Golden Gate University, University of California Santa Cruz",https://www.crunchbase.com/organization/honor-2,"Information Technology, Health Care, Mobile","San Francisco, California, United States",Honor provides personalized home care for people who want to continue to live in the homes they love—safely and happily—as they age.,1676,http://joinhonor.com,Series B,42000000,62000000,-2.7,"Mobile, Home Health Care, Information Technology, Information Services",08/01/2014,08/05/2016,62000000,,1.28,62.0,1.308
430,Cockroach Labs,43.0,"Google, Square, Microsoft, GoDaddy, Oracle","University of California Berkeley, University of Waterloo, Stanford University, Georgia Institute of Technology, Massachusetts Institute of Technology",https://www.crunchbase.com/organization/cockroach-labs,"Data and Analytics, Software","New York, New York, United States",Cockroach Labs provides world class open source infrastructure solutions.,1679,http://www.cockroachlabs.com/,Series B,27000000,53500000,-2.7,"Database, Open Source, Enterprise Software",02/01/2015,05/10/2017,53500000,,0.52,53.5,1.21
431,Hutch,268.0,"Hutch, Alice & Trixie, Excel Infoways Ltd, University of Denver, Comcast Cable","Bangalore University, University of Mumbai, Fashion Institute of Technology, Delhi University, The Institute of Chartered Accountants of India",https://www.crunchbase.com/organization/homee,"Apps, Commerce and Shopping, Information Technology, Real Estate, Community and Lifestyle, Software, Consumer Goods, Internet Services, Messaging and Telecommunications, Mobile","West Hollywood, California, United States","Hutch (formerly HOMEE) is a mobile app that transforms spaces from before to after, faster than ever.",1683,http://hutch.com/,Series A,10000000,17135000,2.5,"Furniture, Lifestyle, Messaging, Apps, Home Decor, E-Commerce, Mobile",09/15/2015,07/12/2017,17135000,,0.35,17.135,0.873
432,Health Catalyst,504.0,"Health Catalyst, Intermountain Healthcare, PeaceHealth, Allina Health, The Church of Jesus Christ of Latter-day Saints","University of Utah, Brigham Young University, University of Utah - David Eccles School of Business, Utah State University, Weber State University",https://www.crunchbase.com/organization/health-catalyst,"Hardware, Information Technology, Consumer Electronics, Data and Analytics, Software, Health Care","Salt Lake City, Utah, United States",Health Catalyst is a tech platform that organizes and links health-related data from different systems and makes it available for all users.,1687,http://healthcatalyst.com,Series E,70000000,292000025,-0.4,"Computer, Software, Analytics, Health Care, Information Technology",01/01/2008,02/29/2016,292000025,,1.72,292.0,0.845
433,LiftIgniter,17.0,"Act-On Software Inc., Seagate Technology, WebEx, Neustar Inc., Henge Docks LLC","Stanford University, Princeton University, The Wharton School, Chennai Mathematical Institute, McGill University",https://www.crunchbase.com/organization/liftigniter,"Science and Engineering, Information Technology, Data and Analytics, Software, Artificial Intelligence","San Francisco, California, United States",LiftIgniter is a machine learning personalization layer powering user interactions on every digital touchpoint.,1689,http://www.liftigniter.com/,Series A,6400000,6450000,8.8,"Personalization, Information Technology, Predictive Analytics, Artificial Intelligence, Machine Learning",01/01/2013,08/17/2017,6450000,,0.25,6.45,1.323
434,Poshmark,472.0,"Poshmark, Nordstrom, Kaboodle, Walmart, eBay","University of California Berkeley, San Jose State University, FIDM, University of Phoenix, University of Illinois at Urbana-Champaign",https://www.crunchbase.com/organization/poshmark,"Commerce and Shopping, Community and Lifestyle, Clothing and Apparel, Internet Services, Design, Mobile","Redwood City, California, United States",Poshmark is the largest social marketplace for fashion.,1699,http://poshmark.com,Series D,25000000,65500000,-1.0,"Mobile, Real Time, Fashion, Communities, E-Commerce, Internet",02/01/2011,04/13/2016,65500000,,1.6,65.5,1.183
435,BlueVine,131.0,"BlueVine, Israel Defense Forces, Google, PayPal, Square","Tel Aviv University, The Hebrew University of Jerusalem, Ben-Gurion University of the Negev, San Francisco State University, The Open University of Israel",https://www.crunchbase.com/organization/bluevine,Financial Services,"Redwood City, California, United States",BlueVine allows small businesses to get paid immediately on their outstanding invoices.,1706,http://www.bluevine.com,Debt Financing,75000000,188000000,-0.6,"FinTech, Small and Medium Businesses, Finance",07/01/2013,02/28/2017,113000000,,0.72,113.0,0.873
436,Heal,212.0,"Heal, Microsoft, Google, Groupon, University of California, Santa Barbara","University of California Los Angeles, University of California Berkeley, University of Southern California, University of California Santa Barbara",https://www.crunchbase.com/organization/heal,"Apps, Software, Health Care","Century City, California, United States",Heal is bringing technology innovation to re-humanize the practice of medicine in a way that is fulfilling for doctors and patients alike.,1708,http://www.getheal.com/,Series B,14600000,51100000,-0.7,"Health Care, Health Diagnostics, Apps, Personal Health, Home Health Care",10/01/2014,12/06/2016,51100000,,0.95,51.1,0.961
437,Porch,265.0,"Porch, Microsoft, ACTIVE Network, LLC, University of Washington, Luth Research","University of Washington, Western Washington University, Washington State University, Gonzaga University, University of Michigan",https://www.crunchbase.com/organization/porch,"Commerce and Shopping, Real Estate, Data and Analytics, Software","Seattle, Washington, United States",Porch.com is a home services platform that helps homeowners maintain their home and get projects done by connecting them with quality pros.,1714,http://porch.com,Series B,65000000,98850000,-0.7,"Home and Garden, Home Improvement, Database, Marketplace",01/01/2012,01/20/2015,98850000,,2.83,98.85,0.786
438,Minted,440.0,"Minted, Gap Inc., IBM, Walmart eCommerce, San Francisco State University","San Francisco State University, Academy of Art University, University of California Berkeley, The Art Institute of California-San Francisco, Carnegie Mellon University",https://www.crunchbase.com/organization/minted,"Commerce and Shopping, Media and Entertainment, Real Estate, Internet Services","San Francisco, California, United States",Minted is a venture-backed social commerce company that crowdsources graphic designs and content from a global design community.,1718,http://www.minted.com,Series D,38000000,89100000,-2.4,"Internet, Art, E-Commerce, Home Decor, Crowdsourcing",08/01/2007,10/30/2014,89100000,,3.05,89.1,0.778
440,Qubit,230.0,"Qubit., Google, BMC Software, Hootsuite, IBM","UCL, University of Bath, University of Oxford, General Assembly, University of Leeds",https://www.crunchbase.com/organization/qubit,"Commerce and Shopping, Media and Entertainment, Information Technology, Data and Analytics, Sales and Marketing, Internet Services, Content and Publishing, Advertising","London, England, United Kingdom","Qubit gives marketers the tools to understand their visitors, and personalize their online presence to drive conversions in real time.",1730,http://www.qubit.com,Series C,40000000,74850000,-1.0,"Advertising, Internet, Data Mining, E-Commerce, Analytics, Publishing, Big Data",01/01/2010,02/22/2016,74850000,,1.74,74.85,0.839
441,Percolate,271.0,"Percolate Inc., NetSuite, Oracle, GLG (Gerson Lehrman Group), Bloomberg LP","New York University, General Assembly, University of California Berkeley, Columbia University in the City of New York, University of California Los Angeles",https://www.crunchbase.com/organization/percolate,"Media and Entertainment, Data and Analytics, Software, Sales and Marketing, Internet Services","New York, New York, United States",The System of Record for Marketing,1733,http://percolate.com,Series C,40000000,74500000,-0.7,"Analytics, Enterprise Software, Content, Social Media, SEO",01/01/2011,05/14/2015,74500000,,2.52,74.5,0.8
442,Reflektive,118.0,"SAP SuccessFactors, Reflektive, Oracle, University of California, Berkeley, Disney Consumer Products and Interactive","University of California Berkeley, University of Colorado Boulder, Cornell University, California Polytechnic State University-San Luis Obispo, San Francisco State University",https://www.crunchbase.com/organization/reflektive,Data and Analytics,"San Francisco, California, United States",Reflektive is an employee success platform that offers real-time feedback and performance reviews.,1735,https://www.reflektive.com/,Series B,25000000,41600000,-0.9,"SaaS, Analytics, Human Resources",01/01/2014,01/26/2017,41600000,,0.81,41.6,1.207
443,Postmates,2063.0,"Postmates, Yelp, Starbucks, Target, Microsoft","San Francisco State University, City College of San Francisco, University of California Berkeley, Long Beach City College, Santa Monica College",https://www.crunchbase.com/organization/postmates,"Food and Beverage, Administrative Services, Transportation","San Francisco, California, United States","Postmates powers local, on-demand logistics focused on fast deliveries from any type of merchant at scale.",1750,https://postmates.com/,Series D,140000000,278010000,-2.8,"Logistics, Delivery, Transportation, Food Delivery, Same Day Delivery",03/01/2011,09/16/2016,278010000,,1.17,278.01,0.867
444,uBiome,115.0,"Globant, uBiome, Groupon, Pontificia Universidad Católica de Chile, Despegar.com","Pontificia Universidad Católica de Chile, Universidad de Chile, Universidad Nacional de La Plata, Universidad Nacional  Andrés Bello, Universidad Técnica Federico Santa María",https://www.crunchbase.com/organization/ubiome,"Biotechnology, Data and Analytics, Software, Health Care, Artificial Intelligence","San Francisco, California, United States",uBiome is the world’s first effort to map the human microbiome with citizen science.,1756,http://ubiome.com,Series B,22000000,26971193,2.3,"Health Care, Machine Learning, Quantified Self",01/01/2012,11/01/2016,26971193,,1.04,26.971,0.865
445,Mirakl,136.0,"Mirakl, CSC, Groupon, Fnac, Pixmania","ESSEC Business School, NEOMA Business School, ESCP Europe, HEC Paris, EDHEC Business School",https://www.crunchbase.com/organization/mirakl,"Commerce and Shopping, Software, Internet Services","Paris, Ile-de-France, France",Mirakl provides on-demand online marketplace capabilities for online businesses on a managed basis.,1761,http://www.mirakl.com,Series B,20000000,23000000,2.1,"Marketplace, SaaS, Internet, Software",02/14/2012,07/22/2015,23000000,,2.33,23.0,0.807
446,Mintigo,75.0,"Mintigo, Israel Defense Forces, Microsoft, LivePerson, Hewlett Packard Enterprise","Tel Aviv University, Bar-Ilan University, Ben-Gurion University of the Negev, Technion - Israel Institute of Technology, The Hebrew University of Jerusalem",https://www.crunchbase.com/organization/mintigo,"Information Technology, Data and Analytics, Software, Sales and Marketing, Artificial Intelligence","San Mateo, California, United States",Mintigo’s Predictive Marketing Platform for enterprise enables insight-driven customer engagement to win and retain customers.,1767,http://www.mintigo.com,Series E,10000000,44000000,-2.3,"Machine Learning, SaaS, Predictive Analytics, CRM, Big Data, Enterprise Software, B2B, Analytics, Marketing Automation",06/01/2009,05/15/2017,44000000,,0.51,44.0,0.873
447,Farmers Business Network,126.0,"Farmer's Business Network Inc., Adobe, John Deere, US Army, Dow AgroSciences","Iowa State University, Purdue University, North Dakota State University, South Dakota State University, University of California Davis",https://www.crunchbase.com/organization/farmers-business-network,"Agriculture and Farming, Science and Engineering, Hardware, Data and Analytics, Software, Internet Services","San Carlos, California, United States","Farmers Business Network connects farmers to share knowledge and gain trusted insights about their farms, inputs, and practices.",1776,http://farmersbusinessnetwork.com,Series C,40000000,83900000,-0.7,"Analytics, Agriculture, Robotics, Farming, Big Data, Social Network",01/01/2014,03/07/2017,83900000,,0.7,83.9,0.872
448,Avvo,415.0,"Avvo, Microsoft, Expedia Inc., Amazon, Washington State University","University of Washington, Washington State University, Western Washington University, Seattle University, University of Washington - Michael G. Foster School of Business",https://www.crunchbase.com/organization/avvo,"Commerce and Shopping, Professional Services","Seattle, Washington, United States","Avvo is a legal marketplace, directory, and question and answer forum that connects individuals with lawyers.",1782,http://avvo.com,Series E,71500000,132000000,-1.8,"Legal, Marketplace, Consulting",01/01/2006,07/28/2015,132000000,,2.31,132.0,0.811
449,PillPack,284.0,"CVS Health, PillPack, Walgreens, RITE AID, Alliance Health, LLC","Massachusetts College of Pharmacy and Health Sciences, University of New Hampshire, Northeastern University, University of Utah, Southern New Hampshire University",https://www.crunchbase.com/organization/pillpack,"Health Care, Internet Services","Cambridge, Massachusetts, United States",PillPack is an online pharmacy offering a modern technology-based system that helps people take timely medication.,1783,http://www.pillpack.com,Series D,55000000,117800000,-1.1,"Pharmaceutical, Hospital, Health Care, Internet",01/31/2013,09/06/2016,117800000,,1.2,117.8,0.862
450,Leanplum,143.0,"Leanplum, Musala Soft, Google, Apple, Upsight","Sofia University St. Kliment Ohridski, San Francisco State University, University of California Berkeley, University of California Santa Cruz, Santa Clara University",https://www.crunchbase.com/organization/leanplum,"Apps, Commerce and Shopping, Data and Analytics, Software, Sales and Marketing, Mobile","San Francisco, California, United States","Leanplum is the most complete mobile marketing platform, delivering meaningful engagement across messaging and the in-app experience.",1785,https://www.leanplum.com,Series C,29000000,46325000,-1.3,"Apps, Analytics, E-Commerce, Marketing Automation, Mobile",01/01/2012,10/18/2016,46325000,,1.08,46.325,0.864
452,Sourcepoint,26.0,"Google, Admeld, Bloomberg LP, Amazon, AppNexus","Massachusetts Institute of Technology, University of Michigan, App Academy, University of Maryland College Park, Rice University",https://www.crunchbase.com/organization/sourcepoint,"Manufacturing, Media and Entertainment, Internet Services, Content and Publishing","New York, New York, United States",SourcePoint is a content compensation platform that supports a sustainable media ecosystem for consumers and publishers.,1788,http://www.sourcepoint.com/,Series B,16000000,26000000,4.1,"Search Engine, Manufacturing, Publishing, Content",06/01/2015,01/25/2017,26000000,,0.81,26.0,0.869
453,Carbon,326.0,"Tesla, Carbon, Stanford University, University of North Carolina at Chapel Hill, Velocity11","Stanford University, University of North Carolina at Chapel Hill, University of California Berkeley, Massachusetts Institute of Technology, University of California Davis",https://www.crunchbase.com/organization/carbon3d,"Manufacturing, Science and Engineering, Hardware, Software","Redwood City, California, United States","Carbon works at the intersection of hardware, software and molecular science to deliver on the promise of 3D manufacturing.",1796,http://carbon3d.com,Series C,81000000,222000000,-0.6,"Mechanical Engineering, Manufacturing, Robotics, 3D Printing, Industrial Engineering",01/01/2013,09/15/2016,222000000,,1.17,222.0,1.316
454,Maven Clinic,129.0,"Bank of America, Icahn School of Medicine at Mount Sinai, New York-Presbyterian Hospital, Rent The Runway, Montefiore Health System","New York University, University of Pennsylvania, Georgetown University, Hunter College, Santa Clara University",https://www.crunchbase.com/organization/maven-clinic,"Apps, Software, Health Care","New York, New York, United States",Maven is a digital clinic that enables women to book video appointments with its network of health practitioners.,1798,http://www.mavenclinic.com,Series A,10800000,15300000,5.2,"Apps, Health Care",01/01/2014,07/25/2017,15300000,,0.32,15.3,0.873
455,Doctor On Demand,233.0,"vRad (Virtual Radiologic), Castlight Health, PayPal, Doctor On Demand, Benefitfocus","Stanford University, New York University, University of Phoenix, San Jose State University, University of California Berkeley",https://www.crunchbase.com/organization/doctor-on-demand,"Hardware, Information Technology, Software, Health Care","San Francisco, California, United States","Doctor On Demand is a mobile app providing fast and easy access to some of the best doctors, psychologists, and other healthcare providers.",1807,https://www.doctorondemand.com,Series B,62749919,86749919,-1.1,"Hospital, Health Care, Virtualization",10/01/2012,07/20/2015,86749919,,2.33,86.75,1.259
456,Greenhouse Software,220.0,"Greenhouse Software, Amherst College, Epic, eChalk, LinkedIn","New York University, University of Michigan, Duke University, Rutgers University, General Assembly",https://www.crunchbase.com/organization/greenhouse-software,"Software, Professional Services","New York, New York, United States",Greenhouse is a recruiting optimization platform to help companies build and scale their recruiting processes.,1811,http://www.greenhouse.io,Series C,35000000,60130270,-0.8,"Software, B2B, Enterprise Software, Recruiting, SaaS",01/01/2012,08/24/2015,60130270,,2.24,60.13,0.813
457,EverString,118.0,"EverString, Oracle, ADP, Marketo, CEB, now Gartner","San Francisco State University, Tsinghua University, Zhejiang University, California Polytechnic State University-San Luis Obispo, University of California Berkeley",https://www.crunchbase.com/organization/everstring,"Data and Analytics, Software, Sales and Marketing, Artificial Intelligence","San Mateo, California, United States",EverString helps companies leverage data to optimize sales and marketing capabilities,1812,http://everstring.com,Series B,65000000,78700000,-1.2,"Software, Marketing, Predictive Analytics",01/01/2012,10/13/2015,78700000,,2.1,78.7,0.821
458,Clara Labs,35.0,"Amgen, Apple, Marist College, Startup Shell, IBM","Silliman University, The University of Texas at Austin, Rice University, Texas Woman's University, Kaplan University",https://www.crunchbase.com/organization/clara-labs,"Information Technology, Software, Internet Services, Messaging and Telecommunications","San Francisco, California, United States",Clara is your partner in doing great work — a virtual employee that schedules your meetings.,1822,http://www.claralabs.com/,Series A,7000000,12000000,-0.1,"Meeting Software, Email, Task Management",02/19/2014,07/19/2017,12000000,,0.33,12.0,0.873
461,Kahuna,60.0,"Oracle, Salesforce, Yahoo! Inc., Adobe, IBM","San Jose State University, Stanford University, University of Illinois at Urbana-Champaign, University of California Davis, University of Michigan",https://www.crunchbase.com/organization/kahuna,"Hardware, Consumer Electronics, Data and Analytics, Software, Sales and Marketing, Internet Services, Mobile","Redwood City, California, United States","Kahuna is a pioneer in communication automation, dedicated to empowering businesses to grow and thrive in the mobile era.",1838,http://www.kahuna.com,Series B,45000000,58000000,-0.7,"Software, Marketing Automation, Mobile, Analytics, Internet, Computer",01/01/2011,08/19/2015,58000000,,2.25,58.0,0.812
462,Button,11.0,"Caesars Palace, SK+G, Best Buy, Unicover, Sunrise Enterprises","University of North Texas, University of Wyoming",https://www.crunchbase.com/organization/button,"Apps, Software, Sales and Marketing, Mobile, Advertising","New York, New York, United States","Button connects the mobile economy, making it easy for consumers to discover and purchase what they want, when they want it.",1847,https://www.usebutton.com/,Series B,20000000,34550000,-1.3,"Affiliate Marketing, Mobile, Mobile Apps, Enterprise Software",05/01/2014,01/25/2017,34550000,,0.81,34.55,1.151
