,company_name,num_employees,past_companies,past_schools,company_name_url,category_groups,headquarters_location,description,crunchbase_rank,website,last_funding_type,last_funding_amount,total_funding_amount,trend_score,categories,founded_date,last_funding_date,total_equity_funding_amount,valuation_at_ipo,time_since_last_funding,funding_ratio,score
1229,CapLinked,18.0,"PayPal, Kauffman Foundation, Maker Studios Inc, CapLinked, Midwestern Baptist Theological Seminary","California Polytechnic State University-San Luis Obispo, Stanford University, Shanghai University of Finance and Economics, University of Cambridge, Universidad AutÌ_noma de Guadalajara",https://www.crunchbase.com/organization/caplinked,"Software, Financial Services","Redondo Beach, California, United States","CapLinked offers a cloud-based platform for coordinating on asset sales, financings, mergers and acquisitions with secure workspaces.",7737,http://www.caplinked.com,Series Unknown,1000000,10400000,-0.1,"Enterprise Software, Finance, Software, Collaboration",08/02/2010,12/01/2015,10400000,,1.96,10.4,0.826
1230,Medal,31.0,"Novartis, The University of Texas at Austin, AT&T, Brown University, Emoki","University of California Los Angeles, Boston University, Brown University, Technische UniversitÌ_t Wien, Beijing Language and Culture University",https://www.crunchbase.com/organization/medal,"Information Technology, Health Care","San Francisco, California, United States","Extract, transport, translate, and share medical records faster.",7742,https://medal.com,Seed,3775990,3775990,-0.8,"Information Technology, Medical, Health Care",01/01/2015,05/13/2016,3775990,,1.52,3.776,0.847
1231,Wrap Media,13.0,"Digital Garage, EY, Google, MediaCT, Neo Innovation Inc.","Tokyo Institute of Technology, Harvard University, Johannes Gutenberg University Mainz, The Philipp University of Marburg, University of Leeds",https://www.crunchbase.com/organization/wrap-media,"Media and Entertainment, Mobile","San Francisco, California, United States",Wrap is a mobile storytelling and commerce platform that delivers app-like user experiences in bite-sized pieces through the mobile web,7761,http://wrap.co,Series C,9000000,25200000,-0.5,"Content, Mobile, Consumer",01/01/2014,04/19/2016,25200000,,1.58,25.2,0.845
1232,GreenDust,54.0,"Machwan Communication & Research, Interactive Business Solutions Pvt. Ltd, Shergroup, Hewlett Packard Enterprise, Rent-A-Center","Universidad Externado de Colombia, Barkatullah Vishwavidyalaya, Karnataka State Open University, Madurai Kamaraj University, Maharshi Dayanand University",https://www.crunchbase.com/organization/greendust,"Commerce and Shopping, Transportation, Internet Services","Delhi, Delhi, India",We provides branded Refurbished Products,7765,http://www.greendust.com,Series C,10000000,50000000,1.1,"Internet, Logistics, E-Commerce",10/01/2008,09/20/2013,50000000,,4.16,50.0,0.749
1233,Lenda,29.0,"Wells Fargo, Fidelity Investments, LendingClub, Sungevity, Lenda","University of San Francisco, NYU Stern School of Business, City College of San Francisco, University of Vienna, University of Sydney",https://www.crunchbase.com/organization/lenda,"Real Estate, Financial Services","San Francisco, California, United States",Lenda is an online platform that enables individuals to refinance their home loans online.,7791,https://www.lenda.com,Series Unknown,2000000,3996000,-0.4,"Real Estate, Finance",08/18/2012,11/24/2015,3996000,,1.98,3.996,0.825
1235,FLX Bio,60.0,"Flexus Biosciences, Genentech, Amgen, Bristol-Myers Squibb, Stanford University","University of California Berkeley, San Francisco State University, University of California Davis, University of Geneva, University of Oxford",https://www.crunchbase.com/organization/flx-bio,"Biotechnology, Science and Engineering, Health Care","South San Francisco, California, United States","FLX Bio (“FLX”) is a biotechnology company focused on the discovery, development, and commercialization of immunotherapies.",7801,http://www.flxbio.com,Series B,50000000,79000000,1.8,"Therapeutics, Medical, Biotechnology",04/01/2015,04/26/2016,79000000,,1.56,79.0,1.185
1236,Varentec,35.0,"3M, AREVA T&D, Siemens, Echelon, Varentec Inc.","Georgia Institute of Technology, McGill University, Nanyang Technological University, San Jose State University, Virginia Tech",https://www.crunchbase.com/organization/varentec,"Manufacturing, Hardware, Sustainability, Consumer Electronics","San Jose, California, United States",Varentec develops advanced power electronic-based systems for electric grid and industrial applications.,7829,http://www.varentec.com,Series C,13000000,41916889,0.1,"Manufacturing, CleanTech, Electronics",01/01/2002,11/14/2015,37916889,,2.01,37.917,0.974
1237,Service,12469.0,"IBM Global Business Services Talent & Engagement, IBM, Accenture, GENPACT, IBM Global Business Process Services","Delhi University, Bangalore University, University of the Philippines, Kendriya Vidyalaya, Polytechnic University of the Philippines",https://www.crunchbase.com/organization/service-2,"Software, Mobile","Los Angeles, California, United States",Service contacts a company's customer service on behalf of the consumer to rectify any issues.,7848,http://getservice.com,Seed,1500000,5140000,-1.3,"Mobile, Customer Service, Software",01/01/2015,06/20/2017,5140000,,0.41,5.14,0.872
1239,Soraa,215.0,"Soraa, Intel Corporation, Lumileds, VIAVI Solutions, FormFactor Inc.","San Jose State University, University of California Santa Barbara, University of California Los Angeles, University of Illinois at Urbana-Champaign, University of California Berkeley",https://www.crunchbase.com/organization/soraa,"Manufacturing, Hardware, Consumer Electronics","Fremont, California, United States",Soraa is a cleantech startup developing LED and Laser technologies.,7868,http://soraa.com,Debt Financing,8000000,101600000,-0.2,"Manufacturing, Lighting, Electronics",01/01/2008,01/31/2013,93600000,,4.8,93.6,0.741
1240,Boom Fantasy,14.0,"IAF - Israeli Air Force, Carestream, High 5 Games, Saint Bonaventure University, Oracle","Stanford University Graduate School of Business, Illinois State University, Fairleigh Dickinson University, Columbia University in the City of New York, Indian Institute of Technology Delhi",https://www.crunchbase.com/organization/boom-shakalaka,"Gaming, Sports, Mobile","New York, New York, United States",Boom Shakalaka is an in-game fantasy sports company.,7876,https://www.boomfantasy.com/,Seed,2000000,3400000,-2.8,"Sports, Mobile, Fantasy Sports",12/01/2014,05/31/2017,3400000,,0.47,3.4,1.322
1241,Returnly,23.0,"Optimizely, Centura Software, Glassdoor, Middlebury College, PowerReviews","Saint Michael's College, Bond University, UNSW, ESADE Business & Law School, Universidad AutÌ_noma de Madrid",https://www.crunchbase.com/organization/return,"Commerce and Shopping, Payments, Financial Services","Larkspur, California, United States",Returnly is a Fintech platform that turns product returns into repurchases for online retailers and marketplaces.,7900,https://www.returnly.com,Seed,3220000,3220000,-1.1,"Payments, FinTech, E-Commerce, SaaS",10/01/2014,10/13/2016,3220000,,1.1,3.22,0.862
1242,Move Loot,7.0,"Stringcan, ClaimsComp Inc., Model N, Puregold Duty Free Inc., Actioncoach","Bataan Polytechnic State College, Tomas del Rosario College, University of California Santa Cruz, University of North Carolina at Chapel Hill, UNC Kenan-Flagler Business School",https://www.crunchbase.com/organization/move-loot,"Commerce and Shopping, Consumer Goods","San Francisco, California, United States",Simplifying used furniture sales.,7918,http://moveloot.com,Series A,10000000,21800000,-0.5,"Retail, Furniture, E-Commerce, Marketplace",01/01/2013,08/01/2015,21800000,,2.3,21.8,0.809
1243,DisplayLink,168.0,"DisplayLink, Nokia, Mentor Graphics, Motorola Mobility (a Lenovo Company), NXP Semiconductors","Politechnika _l€Éska w Gliwicach, University of Cambridge, University of York, AGH University of Science and Technology, Anglia Ruskin University",https://www.crunchbase.com/organization/displaylink,"Science and Engineering, Hardware, Software","Palo Alto, California, United States",DisplayLink is a hardware and software company specializing in multi-monitor and zero client computing.,7921,http://www.displaylink.com,Series Unknown,10400000,86650000,-0.6,"Software, Hardware, Semiconductor",01/01/2003,09/10/2012,78650000,,5.19,78.65,0.737
1244,Shuttl,147.0,"Shuttl, Jabong, HealthKart, Tapzo, PayU","Delhi University, Indian Institute of Technology Delhi, Indian Institute of Technology Kanpur, Birla Institute of Technology and Science, Pilani, Indian School of Business",https://www.crunchbase.com/organization/shuttl,"Apps, Software, Transportation, Mobile","Gurgaon, Haryana, India",Shuttl is the future of public transport.,7943,http://shuttl.com/,Series A,20000000,23150890,-0.5,"Mobile, Transportation, Apps",01/01/2015,12/22/2015,23150890,,1.91,23.151,0.735
1245,Utilidata,44.0,"The Search Agency, Utilidata Inc., The Boston Consulting Group (BCG), APC by Schneider Electric, National Grid","University of Rhode Island, Worcester Polytechnic Institute, Northeastern University, University of Massachusetts Lowell, New England Institute of Technology",https://www.crunchbase.com/organization/utilidata,"Energy, Information Technology, Sustainability, Software, Government and Military","Providence, Rhode Island, United States","Utilidata is a software company, developing an intelligence digital platform to control electric grid.",7956,http://www.utilidata.com,Series B,20000000,20000000,1.1,"Software, Energy, GovTech, Power Grid, Energy Efficiency",01/01/1983,12/09/2013,20000000,,3.94,20.0,0.752
1246,Chukong Technologies,74.0,"Sohu.com, Beijing Kunlun Tech Co Ltd (SZ:300418), CSDN, Aubert Films, GE Capital","Beijing Normal University, Hubei University, Nankai University, Northeast Normal University, Anhui University",https://www.crunchbase.com/organization/chukong-technologies,"Gaming, Media and Entertainment, Software, Mobile","Beijing, Beijing, China","Chukong Technologies is a mobile entertainment platform company based in Beijing, China.",7967,http://www.chukong-inc.com,Series D,50000000,83200000,3.3,"Mobile, Content Creators, Developer Tools, Digital Entertainment, Video Games",11/01/2010,10/18/2013,83200000,,4.08,83.2,0.751
1247,Kite,58.0,"Z GROUP PLC, BrowserAngel, I-Link Solutions, Capgemini, M&C Saatchi London","Bath Spa University, King's College London, The Manchester Metropolitan University, University of Reading, National Institute of Technology Kurukshetra",https://www.crunchbase.com/organization/kite-com,"Science and Engineering, Information Technology, Data and Analytics, Software, Artificial Intelligence","San Francisco, California, United States",Kite augments your coding environment with all the internet’s programming knowledge.,7982,https://kite.com/,Seed,4000000,4000000,-1.1,"Developer Platform, Artificial Intelligence, Developer Tools, Information Services",02/01/2014,04/14/2016,4000000,,1.59,4.0,0.844
1248,Arctic Wolf Networks,89.0,"BlackBerry, Code42, Blue Coat Systems acquired by Symantec, Dell Compellent, Dell","University of Waterloo, Conestoga College, University of Guelph, Saint John's University, University of Minnesota-Twin Cities",https://www.crunchbase.com/organization/arctic-wolf-networks,"Information Technology, Data and Analytics, Privacy and Security","Sunnyvale, California, United States",Arctic Wolf provides a managed Firebreak 'detection & response' security service acting as an extension of your IT Security team.,8003,http://arcticwolf.com,Series B,20000000,27200000,-0.7,"Network Security, Cyber Security, Big Data",01/01/2012,12/12/2012,27200000,,4.93,27.2,1.001
1249,textPlus,28.0,"textPlus, Electronic Arts (EA), EA Mobile, Cable&Wireless Worldwide, Meteor","The University of Auckland, University of California Los Angeles, University College Cork, Full Sail University, Gujarat University",https://www.crunchbase.com/organization/textplus,"Platforms, Information Technology, Community and Lifestyle, Software, Internet Services, Messaging and Telecommunications, Mobile","Marina Del Rey, California, United States","Gogii is a mobile communications service that enables users to text, talk, and share for free.",8015,http://textplus.com,Series Unknown,6904009,53229009,0.1,"iOS, Messaging, Android, Communities, Mobile",12/01/2007,03/25/2015,53229009,,2.65,53.229,0.793
1250,Verne Global,37.0,"Verne Global, Nokia, Atos, Commvault, DFT (DuPont Fabros Technology)","Reykjavik University, Indian Institute of Technology Bombay, Stanford University, Harvard Business School, Massachusetts Institute of Technology",https://www.crunchbase.com/organization/verne-global,"Hardware, Information Technology, Consumer Electronics","London, England, United Kingdom",Verne Global is a tech company focused on providing data centers.,8027,http://verneglobal.com,Series D,98000000,98000000,2.0,"Computer, Data Center, Information Technology",01/01/2007,01/12/2015,98000000,,2.85,98.0,0.786
1251,Calient Technologies,83.0,"CALIENT Technologies Inc., Cisco, AT&T, 3Com, Nokia","University of California Santa Barbara, ITT Technical Institute-Oxnard, Indian Institute of Technology Kanpur, Osmania University, University of Madras",https://www.crunchbase.com/organization/calient-technologies,"Manufacturing, Hardware, Information Technology, Consumer Electronics, Software, Internet Services","Goleta, California, United States",Calient provides high density 3D MEMS optical circuit switching for software-defined networks and data centers.,8042,http://www.calient.net,Series Unknown,6000000,405118814,0.1,"Data Center, Electronics, Telecommunications, Consumer Electronics, Manufacturing, Cloud Computing",01/01/1999,08/16/2016,405118814,,1.25,405.119,0.868
1252,OneID,6.0,"RatePoint, Inc, TC TrustCenter, Rocket Ninja, Employease, Webmaster Freelance","UniversitÌ© d'Angers, Columbia University in the City of New York, Algonquin College of Applied Arts and Technology, California State University-San Bernardino, Northwestern University - Kellogg School of Management",https://www.crunchbase.com/organization/oneid,"Information Technology, Software, Internet Services, Privacy and Security","San Francisco, California, United States","OneID is an identity and security platform for the IoT and web connected world, including devices, servers, applications, and humans.",8046,http://www.oneid.com,Series A,7000000,7000000,2.8,"Developer APIs, Software, Identity Management, Internet of Things",01/01/2011,04/11/2012,7000000,,5.61,7.0,0.732
1253,Runscope,6.0,"Keen IO, Twilio Inc., SC Fundamental LLC, Treefort | Screenfeed, Thomson Reuters","University of Florida - Warrington College of Business, Senac SÌ£o Paulo, University of California Berkeley, Harvard University, Pace University",https://www.crunchbase.com/organization/runscope,"Hardware, Software, Internet Services","San Francisco, California, United States",Runscope develops tools that support the modern application development life cycle.,8055,http://www.runscope.com,Series A,6000000,7100000,-0.2,"Developer Tools, Cloud Infrastructure, Enterprise Software, Developer APIs",01/01/2013,04/10/2014,7100000,,3.61,7.1,0.759
1254,Cambridge Epigenetix,29.0,"Cambridge Epigenetix, University of Cambridge, European Bioinformatics Institute | EMBL-EBI, University of Arizona, Imperial College London","The University of Manchester, University of Cambridge, Imperial College London, University of East Anglia, Heidelberg University",https://www.crunchbase.com/organization/cambridge-epigenetix,"Biotechnology, Science and Engineering, Health Care","Cambridge, Cambridgeshire, United Kingdom","Cambridge Epigenetix (CEGX) is a biosciences company that aims to be the world leading provider of high quality, easy to use epigenetic",8076,http://www.cambridge-epigenetix.com,Series B,21000000,26500000,-0.1,"Genetics, Life Science, Health Diagnostics, Biotechnology",01/01/2012,03/14/2016,26500000,,1.68,26.5,0.841
1255,Trusted Insight,23.0,"Corning Incorporated, Microsoft, Yahoo! Inc., Apple, CenturyLink Business for Enterprise","National Taiwan University, Williams College, New York University, University of Waterloo, Fudan University",https://www.crunchbase.com/organization/trusted-insight,"Community and Lifestyle, Financial Services, Lending and Investments","New York, New York, United States",Trusted Insight is the leading Institutional Syndication Platform for Alternative Assets. Its members manage over $18 Trillion in AUM.,8094,http://www.thetrustedinsight.com,Series A,5000000,7700000,-0.6,"FinTech, Hedge Funds, Private Social Networking, Finance, Venture Capital",01/01/2010,05/14/2015,7700000,,2.52,7.7,0.798
1256,"Minio, Inc.",21.0,"Microsoft, Red Hat, Gluster, Sun Microsystems, SAP","Massachusetts Institute of Technology, Annamalai University, National Institute of Technology Tiruchirappalli, INSEAD, UniversitÌ© Paris-Sorbonne",https://www.crunchbase.com/organization/minio-inc,"Hardware, Information Technology, Software, Internet Services","Palo Alto, California, United States",Minio is an object storage server built for cloud application developers and devops.,8100,https://www.minio.io,Seed,3300000,3300000,0.6,"Open Source, Software, Data Center, Internet, Cloud Storage",11/22/2014,06/17/2015,3300000,,2.42,3.3,0.802
1257,UXPin,59.0,"UXPin, Google, Nokaut.pl, GRUPA NOKAUT S A, GetResponse","University of Gdansk, Gdaãsk University of Technology, Osmania University, AGH University of Science and Technology, Akademia Sztuk Pi€ªknych w Gdaãsku",https://www.crunchbase.com/organization/uxpin,"Hardware, Information Technology, Consumer Electronics, Software","Mountain View, California, United States","UXPin allows product teams and designers to build low and high-fidelity, interactive, realistic web and mobile wireframes and prototypes.",8120,http://uxpin.com,Series A,5000000,7300000,-1.0,"Information Technology, Computer, Software",11/11/2010,07/23/2015,7300000,,2.32,7.3,0.808
1258,Nanosolar,83.0,"Seagate Technology, IBM, US Navy, Solyndra, MiaSolÌ©","Beijing Institute of Technology, San Jose State University, Stanford University, The University of Toledo, University of Buenos Aires",https://www.crunchbase.com/organization/nanosolar,"Natural Resources, Science and Engineering, Energy, Sustainability","San Jose, California, United States",Nanosolar prints solar cells and assembles panels to enable the most cost-efficient solar electricity.,8130,http://www.nanosolar.com,Private Equity,70000000,540000000,0.4,"Solar, Nanotechnology, Renewable Energy",01/01/2002,06/01/2012,520000000,,5.47,520.0,0.746
1259,ZopNow,144.0,"ZopNow, Dell, Myntra, Deloitte, Lifestyle International Pvt Ltd","Indian Institute Of Information Technology, Indian Institute of Technology Bombay, Indira Gandhi National Open University, University of Pune, PES University",https://www.crunchbase.com/organization/zopnow,"Apps, Commerce and Shopping, Food and Beverage, Software, Mobile","Bangalore, Karnataka, India",Our vision is to help people save time with the hope that they can spend this 'saved time' on something more meaningful.,8136,http://www.zopnow.com,Series A,10000000,10000000,-0.3,"Mobile Apps, Grocery, E-Commerce",09/13/2011,04/13/2015,10000000,,2.6,10.0,0.794
1260,Plum District,51.0,"Marriott International, Embassy Suites, Nordstrom, Service Merchandise","Temple University Graduate School, University of Colorado Boulder, University of Maryland University College, East Carolina University, Carlow University",https://www.crunchbase.com/organization/plum-district,"Commerce and Shopping, Community and Lifestyle","San Francisco, California, United States","Plum District is an e-commerce platform that offers products, activities and inspiration for all mothers.",8146,http://plumdistrict.com,Series C,20000000,30600000,-0.2,"E-Commerce, Mothers, Communities",01/01/2009,12/08/2011,30600000,,5.95,30.6,0.731
1261,Zylo,24.0,"ExactTarget, Salesforce, Genesys | Interactive Intelligence, Determine, Taylor University","Indiana University Bloomington, Purdue University, Taylor University, University of Adelaide, Southern Illinois University, Carbondale",https://www.crunchbase.com/organization/zylo,Software,"Indianapolis, Indiana, United States","Zylo is focused on unlocking the full potential of SaaS for buyers, providers, and users alike.",8175,http://zylo.com,Seed,3300000,3300000,-0.5,"SaaS, Enterprise Software",01/01/2015,10/13/2016,3300000,,1.1,3.3,0.769
1262,Asana,338.0,"Asana, Google, Facebook, Apple, Palantir Technologies","Stanford University, Cornell University, University of California Berkeley, Massachusetts Institute of Technology, University of Cape Town",https://www.crunchbase.com/organization/asana,"Apps, Software, Mobile","San Francisco, California, United States","Asana is easiest way for teams to track their work—and get results. It’s free to use, simple and powerful.",8218,http://www.asana.com,Series C,50000000,88200000,-2.7,"Mobile Apps, Enterprise Software, Collaboration, Task Management",01/01/2008,03/30/2016,88200000,,1.64,88.2,1.294
1263,VoloAgri Group,38.0,"Bayer, Monsanto Company, Syngenta, VoloAgri Group Inc., Accessories Marketing Inc. -Slime","California Polytechnic State University-San Luis Obispo, Punjab Agricultural University, University of California Davis, Universidad de Lima, University of Iowa",https://www.crunchbase.com/organization/voloagri-group,Financial Services,"South San Francisco, California, United States",VoloAgri is an ag-tech company providing plant breeding and plant genetics services.,8240,http://voloagri.com,Series Unknown,51032000,116592000,1.9,"Finance, FinTech, Financial Services",01/01/2012,09/21/2015,116592000,,2.16,116.592,0.818
1265,Vedantu,161.0,"Vedantu, Lakshya Institute, Intel Corporation, Dell, TutorVista Global Pvt Ltd","Kendriya Vidyalaya, Visvesvaraya Technological University, Indian Institute of Technology Bombay, Indian Institute of Technology Kharagpur, Indian Institute of Technology Roorkee",https://www.crunchbase.com/organization/vedantu-innovations,"Software, Education, Mobile","Bangalore, Karnataka, India",Vedantu provides personalized LIVE Online Tutoring. Vedantu aims to democratize teaching by creating a marketplace of Teachers,8281,http://www.vedantu.com,Series A,5000000,5550000,-0.6,"EdTech, Education, Mobile, Tutoring",10/29/2011,05/07/2015,5550000,,2.53,5.55,0.797
1266,RAW Pressery,73.0,"PepsiCo, RAW Pressery, OgilvyOne Worldwide, ColdEX Logistics, Procter & Gamble","University of Mumbai, Delhi University, Bangalore University, Mithibai College, University of Bedfordshire",https://www.crunchbase.com/organization/raw-pressery,Manufacturing,"Parel, Maharashtra, India","At RAW Pressery, They have a team of nutritionists, dieticians and medical experts to create our juices.",8286,https://www.rawpressery.com,Series Unknown,543000,6843000,-0.4,Manufacturing,01/01/2013,04/17/2017,6843000,,0.59,6.843,0.871
1268,"MCube, Inc",54.0,"Cypress Semiconductor Corporation, mCube Inc., Honeywell, MEMSIC, HTC","National Tsing Hua University, National Cheng Kung University, University of California Berkeley, Zhejiang University, National Taiwan University",https://www.crunchbase.com/organization/mcube-inc,"Science and Engineering, Hardware, Internet Services","San Jose, California, United States",mCube offers a complete portfolio of motion sensor hardware and software solutions for its clients.,8347,http://www.mcubemems.com/,Series C,37000000,37000000,0.1,"Sensor, Internet of Things, Semiconductor",01/01/2009,06/25/2014,37000000,,3.4,37.0,0.765
1269,Plate IQ,24.0,"Vino Volo, Zocdoc, Harri, SinglePlatform, BlackBerry","University of Madras, Western University, Harvard University, Hunter College, Fordham University",https://www.crunchbase.com/organization/plate-iq,"Food and Beverage, Data and Analytics","San Francisco, California, United States",Plate IQ streamlines restaurant operations to reduce costs and save time.,8348,http://plateiq.com/,Seed,4000000,4500000,-0.9,"Business Intelligence, Restaurants, Small and Medium Businesses, B2B",01/01/2014,03/20/2017,4500000,,0.66,4.5,0.87
1270,Vium,46.0,"BTS Research, Covance, Adecco, Wellesley College, Stanford University School of Medicine","Stanford University, University of California Santa Cruz, University of Phoenix, Massachusetts Institute of Technology, Princeton University",https://www.crunchbase.com/organization/mousera,"Biotechnology, Science and Engineering, Health Care","San Mateo, California, United States","Vium, Inc. develops medical technology. The company is headquartered in the United States.",8351,http://www.vium.com,Series A,20000004,29940004,-0.4,"Life Science, Biotechnology, Medical Device",01/01/2013,06/09/2015,29940004,,2.44,29.94,1.252
1271,Blue Danube Systems,48.0,"Nokia, Qualcomm, Applied Materials, Nokia Bell Labs, Cisco","Stanford University, Columbia University in the City of New York, University of Mumbai, Virginia Tech, University of Science and Technology of China",https://www.crunchbase.com/organization/blue-danube-labs,"Hardware, Mobile","Mountain View, California, United States",Blue Danube Systems develops hardware and software solutions to increase average user data rates for wireless communication systems.,8372,http://bluedanube.com,Series B,16199996,33892496,-0.1,"Hardware, Mobile, Wireless",09/20/2006,12/29/2015,33892496,,1.89,33.892,1.28
